line,filename,lines,type,character,text
905,undefined,undefined,dialogue,*Kira* Miki,The sun should come up just as I reach the climax of the song.
906,undefined,undefined,dialogue,*Kira* Miki,"I'd be depressed if they ask for ""Your Love Is A Drug"" as an encore though..."
907,undefined,undefined,dialogue,Jill,That sounds nice.
908,undefined,undefined,dialogue,*Kira* Miki,"Hey, I need to make people feel their tickets were worth the ridiculous price, you know?"
909,undefined,undefined,dialogue,*Kira* Miki,"Don't you think it sucks to pay for something, only to find out you shouldn't have bothered?"
910,undefined,undefined,dialogue,Jill,Yeah. One time I bought some expensive coffee in this one cafe...
911,undefined,undefined,dialogue,Jill,"It tasted like filthy water with cream. I still don't know if it was the coffee or the girl that served it, but it was BAD."
912,undefined,undefined,dialogue,*Kira* Miki,"Man, that sucks."
913,undefined,undefined,dialogue,*Kira* Miki,"Speaking of which, do you have anything bitter? I really need to wake myself up."
914,undefined,undefined,dialogue,Jill,Let's see what I can find for you.
915,undefined,undefined,dialogue,Jill,Try this.
916,undefined,undefined,dialogue,*Kira* Miki,"Yeah, this works."
917,undefined,undefined,dialogue,Jill,"So, how is it?"
918,undefined,undefined,dialogue,*Kira* Miki,It could be a bit sweeter but it's delicious.
919,undefined,undefined,dialogue,Jill,I figured it was for waking you up or something so...
920,undefined,undefined,dialogue,*Kira* Miki,"Really nice, thanks!"
921,undefined,undefined,dialogue,Jill,Here.
922,undefined,undefined,dialogue,*Kira* Miki,"This is good, but it isn't exactly what I needed."
923,undefined,undefined,dialogue,Jill,And what did you need?
924,undefined,undefined,dialogue,*Kira* Miki,"Something that'll wake me up, or help me sober up a bit before going back."
925,undefined,undefined,dialogue,Jill,You could've said so earlier and I would've fixed you something like that.
926,undefined,undefined,dialogue,*Kira* Miki,...the order's still wrong though.
927,undefined,undefined,dialogue,Jill,I'm not arguing that.
928,undefined,undefined,dialogue,Jill,"I hope you aren't offended by this question, but..."
929,undefined,undefined,dialogue,*Kira* Miki,Hm?
930,undefined,undefined,dialogue,Jill,"I can see that you enjoy what you do, but how much of it is about the music?"
931,undefined,undefined,dialogue,*Kira* Miki,"I'll let you know that before becoming *Kira* Miki, I was a very accomplished pianist."
932,undefined,undefined,dialogue,*Kira* Miki,I had concerts every week and part-timed in bars with a jazz band.
933,undefined,undefined,dialogue,*Kira* Miki,I still write and compose my own songs!
934,undefined,undefined,dialogue,Jill,Whoa...
935,undefined,undefined,dialogue,Jill,Why the change?
936,undefined,undefined,dialogue,Jill,Going from jazz and piano to idol...
937,undefined,undefined,dialogue,*Kira* Miki,Have you ever thought about the power music has over people?
938,undefined,undefined,dialogue,*Kira* Miki,"You could argue it's just noise, but it can make you feel a wide range of emotions."
939,undefined,undefined,dialogue,*Kira* Miki,And that power is universal. It can transcend language and culture.
940,undefined,undefined,dialogue,*Kira* Miki,"Being in a jazz band or performing recitals, I can only take that power to so many people."
941,undefined,undefined,dialogue,*Kira* Miki,"But being an Idol, I can take that power and spread it far and wide!"
942,undefined,undefined,dialogue,*Kira* Miki,"Kids and adults, men and women. They all have access to my music, and I can reach every one of them!"
943,undefined,undefined,dialogue,Jill,Wow...
944,undefined,undefined,dialogue,*Kira* Miki,"What music do you like, Jill?"
945,undefined,undefined,dialogue,Jill,"I'm not picky, but I do prefer versions with no lyrics."
946,undefined,undefined,dialogue,*Kira* Miki,Why?
947,undefined,undefined,dialogue,Jill,"I like to listen to music while working, and lyrics distract me."
948,undefined,undefined,dialogue,Jill,"And besides, it always bothers me when people nonchalantly start singing songs with creepy lyrics."
949,undefined,undefined,dialogue,Jill,I think only half of the listeners actually care about what's being said.
950,undefined,undefined,dialogue,*Kira* Miki,"Oh, that's a bummer."
951,undefined,undefined,dialogue,*Kira* Miki,"I'd give you a copy of my latest CD, but I don't have any at the moment."
952,undefined,undefined,dialogue,Jill,Don't worry about it.
953,undefined,undefined,dialogue,Jill,"Hey, do you get flowers and that kind of stuff when you do concerts?"
954,undefined,undefined,dialogue,*Kira* Miki,Yeah! Lots!
955,undefined,undefined,dialogue,*Kira* Miki,"I once said in an interview that I loved blue roses, so people started sending them to me!"
956,undefined,undefined,dialogue,Jill,Blue roses? There's such a thing?
957,undefined,undefined,dialogue,*Kira* Miki,"No, silly. They're just dyed white roses. But they're so pretty!"
958,undefined,undefined,dialogue,Jill,(You'd think blue roses would be a reality by now.)
959,undefined,undefined,dialogue,Jill,Any interesting gifts you can remember?
960,undefined,undefined,dialogue,*Kira* Miki,Let's see...
961,undefined,undefined,dialogue,*Kira* Miki,A guy named Danny sent a 1/60th scale chocolate sculpture of me!
962,undefined,undefined,dialogue,*Kira* Miki,"Her boobs were a bit smaller, though."
963,undefined,undefined,dialogue,*Kira* Miki,But... he did request a video of me eating it. I feel kinda guilty for not complying.
964,undefined,undefined,dialogue,Jill,Oh. I had a classmate with that same fetish in high school. Lunchtime was awkward.
965,undefined,undefined,dialogue,Jill,"Wait, no. The fetish had nothing to do with it. He was the awkward one."
966,undefined,undefined,dialogue,*Kira* Miki,"There was also this girl named Roxanne who sent me an oil painting, canvas and all!"
967,undefined,undefined,dialogue,*Kira* Miki,It was a rendition of a photo from one of my swimwear photoshoots.
968,undefined,undefined,dialogue,*Kira* Miki,"It was my favorite shot! Paul, the photographer, caught me while I was adjusting the bikini's top."
969,undefined,undefined,dialogue,*Kira* Miki,It just looks so natural...
970,undefined,undefined,dialogue,*Kira* Miki,"Anyway, I still have that painting in my lobby."
971,undefined,undefined,dialogue,*Kira* Miki,I'm even considering commissioning Roxanne to do another one!
972,undefined,undefined,dialogue,Jill,Something tells me you're one human sacrifice away from being a pagan goddess of sorts.
973,undefined,undefined,dialogue,*Kira* Miki,"Calling me a goddess won't get you anywhere, you know?"
974,undefined,undefined,dialogue,*Kira* Miki,You need to be more creative with your flattery.
975,undefined,undefined,dialogue,*Kira* Miki,There was an attempt that involved a sacrifice though... but the police solved that one quickly.
976,undefined,undefined,dialogue,Jill,I'm surprised you remember all those names.
977,undefined,undefined,dialogue,*Kira* Miki,I try to remember as many of my fans' names as possible. I'd be a bad Idol if I didn't.
978,undefined,undefined,dialogue,*Kira* Miki,"Okay then, I'm out."
979,undefined,undefined,dialogue,*Kira* Miki,"Thanks for helping me pass the time, Jill!"
980,undefined,undefined,dialogue,Jill,Sure.
981,undefined,undefined,dialogue,Jill,Please come again.
982,undefined,undefined,dialogue,*Kira* Miki,I'll make sure of it!
983,undefined,undefined,dialogue,Gillian,Will she be alright?
984,undefined,undefined,dialogue,Jill,"Yeah, she'll be fine."
985,undefined,undefined,dialogue,Gillian,You think she'll come back?
986,undefined,undefined,dialogue,Jill,"Usually I'd say no, but I honestly don't know."
987,undefined,undefined,dialogue,*Kira* Miki,"Hey Jill, have you ever lost your identity?"
988,undefined,undefined,dialogue,Jill,"I've lost my ID card a couple of times, yeah."
989,undefined,undefined,dialogue,*Kira* Miki,"No, I mean... your identity. Forgotten who you are."
990,undefined,undefined,dialogue,Jill,(What's with the change in expression?!)
991,undefined,undefined,dialogue,Jill,"N-No, not really..."
992,undefined,undefined,dialogue,*Kira* Miki,I did.
993,undefined,undefined,dialogue,Jill,Eh?
994,undefined,undefined,dialogue,*Kira* Miki,*Kira* Miki is just an artist name.
995,undefined,undefined,dialogue,*Kira* Miki,"At first, it was hard for me to play the part, you know?"
996,undefined,undefined,dialogue,*Kira* Miki,But I gained so much satisfaction from the concerts that I decided to invest myself.
997,undefined,undefined,dialogue,*Kira* Miki,...and I overdid it.
998,undefined,undefined,dialogue,Jill,How so?
999,undefined,undefined,dialogue,*Kira* Miki,I became so invested in the character that I forgot who I was.
1000,undefined,undefined,dialogue,*Kira* Miki,Who was I before I became *Kira* Miki? What did I like?
1001,undefined,undefined,dialogue,*Kira* Miki,Where does *Kira* Miki end and I begin?
1002,undefined,undefined,dialogue,*Kira* Miki,I... just don't know anymore.
1003,undefined,undefined,dialogue,Jill,Sounds rough.
1004,undefined,undefined,dialogue,Jill,What drove you to such a decision?
1005,undefined,undefined,dialogue,*Kira* Miki,The fact that I know I'm performing a noble duty.
1006,undefined,undefined,dialogue,Jill,H-How?
1007,undefined,undefined,dialogue,*Kira* Miki,You have to deal with many stressful things in everyday life.
1008,undefined,undefined,dialogue,*Kira* Miki,"Work, debt, sickness, insecurity, the black slime that comes out of the sewers every full moon..."
1009,undefined,undefined,dialogue,*Kira* Miki,You don't know what will await you every morning.
1010,undefined,undefined,dialogue,*Kira* Miki,You don't know if you'll make it back to bed that night.
1011,undefined,undefined,dialogue,*Kira* Miki,"When measured, the cons of life outweigh the pros."
1012,undefined,undefined,dialogue,*Kira* Miki,"People need something to cling to, and for many I'm that thing."
1013,undefined,undefined,dialogue,Jill,You are?
1014,undefined,undefined,dialogue,*Kira* Miki,"During my concerts, they stop being themselves for 4 hours."
1015,undefined,undefined,dialogue,*Kira* Miki,"They're not a nurse, an office worker, or a store clerk."
1016,undefined,undefined,dialogue,*Kira* Miki,"For those 4 hours, they're just part of the mass that goes to see an idol."
1017,undefined,undefined,dialogue,*Kira* Miki,"No religion, gender, or social class divides them. They're all at the same level."
1018,undefined,undefined,dialogue,Jill,Damn...
1019,undefined,undefined,dialogue,*Kira* Miki,"When not in concert, I try to give them songs that will cheer them up, that will make their lives worth living."
1020,undefined,undefined,dialogue,*Kira* Miki,"When I see the people call my name from the stage, I know they're thanking me."
1021,undefined,undefined,dialogue,*Kira* Miki,Thanking me for that single moment where they can be happy.
1022,undefined,undefined,dialogue,*Kira* Miki,That's what I love about the stadium. I'm down below while they're up high.
1023,undefined,undefined,dialogue,*Kira* Miki,"If forgetting who I was before means that I can protect those smiles, SO BE IT!"
1024,undefined,undefined,dialogue,*Kira* Miki,I'll make that sacrifice as many times as needed.
1025,undefined,undefined,dialogue,*Kira* Miki,Because I live for them. Because I know I help them.
1026,undefined,undefined,dialogue,*Kira* Miki,I'm the star that always shines in the dark night sky!
1027,undefined,undefined,dialogue,*Kira* Miki,I'm the glow that will guide you through your sorrow!
1028,undefined,undefined,dialogue,*Kira* Miki,I'm the northern light that will show you your dreams!
1029,undefined,undefined,dialogue,*Kira* Miki,I am *Kira* Miki!
1030,undefined,undefined,dialogue,*Kira* Miki,And don't you ever forget that.
1031,undefined,undefined,dialogue,Jill,...
1032,undefined,undefined,dialogue,*Kira* Miki,FANCLUB! TO ME!
1033,undefined,undefined,dialogue,*Kira* Miki,We ride to the stadium!
1034,undefined,undefined,dialogue,Jill,...wow.
1035,undefined,undefined,dialogue,Gillian,"She's something else, huh?"
1036,undefined,undefined,dialogue,Jill,I suddenly feel the urge to ditch my shift and follow.
1037,undefined,undefined,dialogue,Gillian,Do you think she's telling the truth?
1038,undefined,undefined,dialogue,Jill,Gimme a sec...
1039,undefined,undefined,dialogue,Jill,"According to this article, her real name is Michelle Kingston. Deployed about 2 years ago."
1040,undefined,undefined,dialogue,Jill,She did a few variety shows with her jazz band but went solo afterwards.
1041,undefined,undefined,dialogue,Gillian,What was all that talk then?
1042,undefined,undefined,dialogue,Jill,She was drunk and she was a very... peculiar drunk.
1043,undefined,undefined,dialogue,Gillian,Figures.
1044,undefined,undefined,dialogue,Gillian,"Still quite the motivational performer, though."
1045,undefined,undefined,dialogue,Jill,No doubt.
1046,undefined,undefined,dialogue,Jill,"Boss, we're done."
1047,undefined,undefined,dialogue,Dana,Alright.
1048,undefined,undefined,dialogue,Dana,You feel like going to that girl's concert?
1049,undefined,undefined,dialogue,Jill,"Nah, I don't think so. I don't have tickets anyway."
1050,undefined,undefined,dialogue,Jill,"Hey, Boss. Does the name ""Red Comet"" ring any bells?"
1051,undefined,undefined,dialogue,Dana,"Why, that was my moniker during my wrestling days."
1052,undefined,undefined,dialogue,Jill,Your... huh?
1053,undefined,undefined,dialogue,Dana,That's what they called me during my time in the Grand Slam Fighters.
1054,undefined,undefined,dialogue,Dana,"They saw me coming, but they couldn't stop me before I CRASHED INTO THEIR HEADS."
1055,undefined,undefined,dialogue,Jill,Any reason for being red specifically?
1056,undefined,undefined,dialogue,Dana,That way I was three times faster!
1057,undefined,undefined,dialogue,Dana,How did you find that out? Do you like wrestling?
1058,undefined,undefined,dialogue,Jill,A client mentioned it yesterday when he saw you. I just kinda remembered it.
1059,undefined,undefined,dialogue,Dana,"Ah, I see."
1060,undefined,undefined,dialogue,Dana,I should take you to a wrestling match sometime. Maybe you'll like it.
1061,undefined,undefined,dialogue,Jill,Maybe.
1062,undefined,undefined,dialogue,Jill,"In any case, Gil's cleaning the glasses today, so I'll leave now."
1063,undefined,undefined,dialogue,Dana,Take care.
1064,undefined,undefined,dialogue,Jill,"Oh, and... boss?"
1065,undefined,undefined,dialogue,Jill,"Don't cram anything on your head without thinking, please."
1066,undefined,undefined,dialogue,Dana,"Yeah, yeah..."
1067,undefined,undefined,dialogue,Jill,(Boss should clean the chicken buckets she throws out. Everyone can smell the spice from a mile away.)