line,filename,lines,type,character,text
309,undefined,undefined,dialogue,Mr. Donovan,I'm Donovan D. Dawson. I always get what I want.
310,undefined,undefined,dialogue,Mr. Donovan,"Sure, I had to blackmail the editors of other outlets, but the end result is what matters."
311,undefined,undefined,dialogue,Jill,I see.
312,undefined,undefined,dialogue,Jill,"Wait, blackmail?"
313,undefined,undefined,dialogue,Mr. Donovan,You'd be surprised at the kind of stuff you find out when you get the right people drunk.
314,undefined,undefined,dialogue,Mr. Donovan,"Hm? Hey, the signature on that glass over there..."
315,undefined,undefined,dialogue,Jill,Ah? Oh yeah...
316,undefined,undefined,dialogue,Mr. Donovan,That big titted Lilim was here?!
317,undefined,undefined,dialogue,Jill,"She came yesterday before the concert, yeah."
318,undefined,undefined,dialogue,Mr. Donovan,Anything juicy come out of her visit?
319,undefined,undefined,dialogue,Jill,No.
320,undefined,undefined,dialogue,Mr. Donovan,Gossip-worthy?
321,undefined,undefined,dialogue,Jill,No.
322,undefined,undefined,dialogue,Mr. Donovan,Tabloid-worthy?
323,undefined,undefined,dialogue,Jill,No.
324,undefined,undefined,dialogue,Mr. Donovan,Come on! There has to be something!
325,undefined,undefined,dialogue,Jill,"Well, her love for what she does is so honest and pure that anyone who tries to ruin it should be ashamed."
326,undefined,undefined,dialogue,Mr. Donovan,"Oh, don't give me that shit."
327,undefined,undefined,dialogue,Mr. Donovan,Throw me a bone here. Anything.
328,undefined,undefined,dialogue,Jill,I've got nothing.
329,undefined,undefined,dialogue,Mr. Donovan,Everyone has a price. How much for you to spill the beans?
330,undefined,undefined,dialogue,Jill,I'm serious here. She said nothing that could be used against her or that you didn't already know.
331,undefined,undefined,dialogue,Mr. Donovan,Fine.
332,undefined,undefined,dialogue,Jill,"Say, are many of your interns women, Mr. Donovan?"
333,undefined,undefined,dialogue,Mr. Donovan,"ALL of my interns are women, kid."
334,undefined,undefined,dialogue,Mr. Donovan,"Every single one of them. It's a pack of hungry, desperate bitches."
335,undefined,undefined,dialogue,Jill,Why only women?
336,undefined,undefined,dialogue,Mr. Donovan,"Did you ever watch ""Race for Hope""?"
337,undefined,undefined,dialogue,Jill,The movie?
338,undefined,undefined,dialogue,Mr. Donovan,Yeah.
339,undefined,undefined,dialogue,Mr. Donovan,A movie about a journalist looking for clues regarding a murder.
340,undefined,undefined,dialogue,Mr. Donovan,"That tacky movie had everything. Romance, action, a dog with sunglasses..."
341,undefined,undefined,dialogue,Mr. Donovan,It also sold this weird fantastical image of what journalism is.
342,undefined,undefined,dialogue,Mr. Donovan,I'm guessing lots of girls saw it in high school and wanted to become journalists.
343,undefined,undefined,dialogue,Mr. Donovan,And now I have to deal with that shit.
344,undefined,undefined,dialogue,Jill,How can you be so sure?
345,undefined,undefined,dialogue,Mr. Donovan,My first brother-in-law was a doctor.
346,undefined,undefined,dialogue,Mr. Donovan,"He said that a couple of years after that ""Emergency Heart"" movie, all of his interns were women for a long while."
347,undefined,undefined,dialogue,Mr. Donovan,And this why you don't let brats that barely understand what responsibilities are pick a career.
348,undefined,undefined,dialogue,Jill,Um...
349,undefined,undefined,dialogue,Jill,Do you perhaps know a girl named Kimberly La Vallette?
350,undefined,undefined,dialogue,Mr. Donovan,Doesn't ring a bell. Who is she?
351,undefined,undefined,dialogue,Jill,Um... nobody. Forget I said anything.
352,undefined,undefined,dialogue,Mr. Donovan,"Hey kid, do you think Lilim have nipples?"
353,undefined,undefined,dialogue,Jill,E-Excuse me?
354,undefined,undefined,dialogue,Mr. Donovan,"I mean, I've seen a couple of pornos where they have 'em, but they could be modded, you know?"
355,undefined,undefined,dialogue,Mr. Donovan,"So yesterday, while interviewing the singer Lilim chick, I kept wondering if those tits had nipples."
356,undefined,undefined,dialogue,Mr. Donovan,"I mean, I'd be fine without them, but the curiosity is killing me."
357,undefined,undefined,dialogue,Jill,...
358,undefined,undefined,dialogue,Mr. Donovan,But I'm even more curious about the engineers that design them.
359,undefined,undefined,dialogue,Mr. Donovan,Can you picture a room full of people discussing whether or not the tits on a Lilim look good?
360,undefined,undefined,dialogue,Mr. Donovan,A bunch of guys and a lesbo engineer wondering if the latest model's vagina is good enough.
361,undefined,undefined,dialogue,Mr. Donovan,"Man, god bless those sonsabitches."
362,undefined,undefined,dialogue,Jill,*ahem*
363,undefined,undefined,dialogue,Jill,Any interesting preview of tomorrow's news?
364,undefined,undefined,dialogue,Mr. Donovan,You expect me to share my information when you wouldn't share your scoop on the singer?
365,undefined,undefined,dialogue,Jill,How can one share when there's honestly nothing to share?
366,undefined,undefined,dialogue,Mr. Donovan,Uh huh...
367,undefined,undefined,dialogue,Mr. Donovan,I'm gonna be a good citizen today and let this one pass.
368,undefined,undefined,dialogue,Mr. Donovan,"Have you heard of a group called ""The Harbingers""?"
369,undefined,undefined,dialogue,Jill,"Not really, no."
370,undefined,undefined,dialogue,Mr. Donovan,They're some group wanting to overthrow the White Knights.
371,undefined,undefined,dialogue,Mr. Donovan,I read their manifesto in the bathroom once. Interesting piece and even better makeshift toilet paper.
372,undefined,undefined,dialogue,Mr. Donovan,"They talk about how the organization is corrupt, full of mob bosses or something like that."
373,undefined,undefined,dialogue,Jill,I think I've heard about that somewhere. What of them?
374,undefined,undefined,dialogue,Mr. Donovan,They sent a message to some outlets saying they have proof of their claims.
375,undefined,undefined,dialogue,Mr. Donovan,That they're gonna release it to the public tomorrow.
376,undefined,undefined,dialogue,Jill,Oh... that'd be interesting to see. I think...
377,undefined,undefined,dialogue,Mr. Donovan,"I know, right?"
378,undefined,undefined,dialogue,Mr. Donovan,"Alright, kid. Give me a Bleeding Jane so I can call it a day."
379,undefined,undefined,dialogue,Jill,Okay.
380,undefined,undefined,dialogue,Jill,Here.
381,undefined,undefined,dialogue,Mr. Donovan,"Simple enough for you, I see."
382,undefined,undefined,dialogue,Jill,...
383,undefined,undefined,dialogue,Jill,Here you go.
384,undefined,undefined,dialogue,Mr. Donovan,"Well, aren't you a cheeky one?"
385,undefined,undefined,dialogue,Jill,...
386,undefined,undefined,dialogue,Jill,Here.
387,undefined,undefined,dialogue,Mr. Donovan,My second wife is more of a Bleeding Jane than this.
388,undefined,undefined,dialogue,Mr. Donovan,"Better luck next time, kid."
389,undefined,undefined,dialogue,Mr. Donovan,"So, I've heard this is Dana Zane's bar. Is it true?"
390,undefined,undefined,dialogue,Jill,Yeah.
391,undefined,undefined,dialogue,Mr. Donovan,Never thought I'd hear about the Undefeated of the West again.
392,undefined,undefined,dialogue,Mr. Donovan,Moreso after that incident with the bears. Where is she?
393,undefined,undefined,dialogue,Jill,She's out running some err-... bears?
394,undefined,undefined,dialogue,Mr. Donovan,"Six years ago, a cash-strapped Dana Zane entered an underground ring for money."
395,undefined,undefined,dialogue,Mr. Donovan,Faced ten enraged grizzly bears. She beat them all without killing them.
396,undefined,undefined,dialogue,Mr. Donovan,I heard she set them free afterwards too.
397,undefined,undefined,dialogue,Jill,And you were there?
398,undefined,undefined,dialogue,Mr. Donovan,I was drunk and bored. What can I say?
399,undefined,undefined,dialogue,Jill,Do you know if she lost her arm there?
400,undefined,undefined,dialogue,Mr. Donovan,"Can't remember, too drunk. Maybe she had her prosthetic then too."
401,undefined,undefined,dialogue,Mr. Donovan,I heard someone there suggest that she lost it after throwing a baseball out of some stadium.
402,undefined,undefined,dialogue,Mr. Donovan,Threw it so hard her arm fell off.
403,undefined,undefined,dialogue,Mr. Donovan,But that sounds more like an unsubstantiated rumor.
404,undefined,undefined,dialogue,Jill,(More like something she made up.)
405,undefined,undefined,dialogue,Mr. Donovan,"Well, I gotta go. Next time you see Dana, thank her for winning me my second yacht."
406,undefined,undefined,dialogue,Mr. Donovan,I knew betting on her was the right choice.
407,undefined,undefined,dialogue,Jill,Please come again.
408,undefined,undefined,dialogue,Mr. Donovan,"Yeah, yeah..."
409,undefined,undefined,dialogue,Mr. Donovan,...
410,undefined,undefined,dialogue,Mr. Donovan,You know what? I've had it with that damned newspaper.
411,undefined,undefined,dialogue,Jill,E-Eh?
412,undefined,undefined,dialogue,Mr. Donovan,This newspaper has become a youthful mess where everyone thinks they're the most important thing on the block.
413,undefined,undefined,dialogue,Mr. Donovan,"Even if I didn't have to deal with those employees, the investors and readers are particularly obnoxious."
414,undefined,undefined,dialogue,Mr. Donovan,And I can't leave them alone because they will still come after my neck when shit hits the fan.
415,undefined,undefined,dialogue,Mr. Donovan,I'm a rich and powerful man who can't live his rich and powerful life peacefully.
416,undefined,undefined,dialogue,Jill,"Well, they do say money can't buy peace..."
417,undefined,undefined,dialogue,Mr. Donovan,But it can buy stuff.
418,undefined,undefined,dialogue,Mr. Donovan,"It lets you stay alive, gives you shelter, and can make you comfortable. And I'm not comfortable."
419,undefined,undefined,dialogue,Mr. Donovan,"Not because I managed things the wrong way, but because others won't let me be."
420,undefined,undefined,dialogue,Mr. Donovan,And this fella has had enough of it.
421,undefined,undefined,dialogue,Jill,What are you gonna do?
422,undefined,undefined,dialogue,Mr. Donovan,Read tomorrow's edition kid. You'll find a nice surprise there.
423,undefined,undefined,dialogue,Jill,...
424,undefined,undefined,dialogue,Jill,(He's either going to kill somebody or post pics of his dick in every article.)
425,undefined,undefined,dialogue,Mr. Donovan,"You know what? I've come to like you, kid."
426,undefined,undefined,dialogue,Jill,...really?
427,undefined,undefined,dialogue,Mr. Donovan,"You keep quiet, don't talk unless talked to, and listen attentively to everything I say."
428,undefined,undefined,dialogue,Mr. Donovan,"If you had more tits and ass, I'd take you out of here right now."
429,undefined,undefined,dialogue,Mr. Donovan,"But there's surgery for that, so the sky's the limit!"
430,undefined,undefined,dialogue,Jill,...
431,undefined,undefined,dialogue,Mr. Donovan,But I know the reality. You're just listening to me because I'm a client.
432,undefined,undefined,dialogue,Mr. Donovan,I can't help but wonder how you are outside of work.
433,undefined,undefined,dialogue,Jill,...
434,undefined,undefined,dialogue,Mr. Donovan,Maybe it's better if I don't know.
435,undefined,undefined,dialogue,Mr. Donovan,Enough about you. It's time for some me time.
436,undefined,undefined,dialogue,Mr. Donovan,Which means grabbing a bitch and banging her until dawn.
437,undefined,undefined,dialogue,Mr. Donovan,"See ya, kid."
438,undefined,undefined,dialogue,Jill,Good night.
439,undefined,undefined,dialogue,Jill,...
440,undefined,undefined,dialogue,Jill,*BRRRRRRRRRRR*
441,undefined,undefined,dialogue,Jill,"Gil, I'll be taking my break now."
442,undefined,undefined,dialogue,Gillian,Alright.
443,undefined,undefined,dialogue,Jill,"Ah, Boss. You're back."
444,undefined,undefined,dialogue,Dana,Yeah. Sorry about not being here earlier.
445,undefined,undefined,dialogue,Jill,What were you doing?
446,undefined,undefined,dialogue,Dana,I had a brief meeting with my BTC regional manager.
447,undefined,undefined,dialogue,Jill,Oh... everything alright?
448,undefined,undefined,dialogue,Dana,"As alright as it can be, considering that we're closing eventually."
449,undefined,undefined,dialogue,Jill,When will that happen?
450,undefined,undefined,dialogue,Dana,I don't know.
451,undefined,undefined,dialogue,Dana,Brian said that we'll be safe for a few months while the paperwork is filed and everything's being put in order.
452,undefined,undefined,dialogue,Jill,Oh...
453,undefined,undefined,dialogue,Dana,I was also talking to him about you.
454,undefined,undefined,dialogue,Jill,About me?
455,undefined,undefined,dialogue,Dana,Yeah. I was telling him to do whatever it takes to ensure you don't spend too much time without a job.
456,undefined,undefined,dialogue,Dana,"If possible, to reassign you ASAP after closing."
457,undefined,undefined,dialogue,Jill,...
458,undefined,undefined,dialogue,Dana,"Hey, if it helps, Brian might be the angriest of us all."
459,undefined,undefined,dialogue,Dana,"""They want to close the only bar in the whole area that hasn't given me any headaches!"" he said."
460,undefined,undefined,dialogue,Jill,Heh...
461,undefined,undefined,dialogue,Jill,What about Gil?
462,undefined,undefined,dialogue,Dana,"He's the one that worries me the most, actually."
463,undefined,undefined,dialogue,Dana,He's kinda working using the credentials of another guy that was working here before.
464,undefined,undefined,dialogue,Jill,Who?
465,undefined,undefined,dialogue,Dana,The one who bought a levitation potion and then threw himself off a building.
466,undefined,undefined,dialogue,Jill,"(Ah yes, the ""levitation potion"" story.)"
467,undefined,undefined,dialogue,Jill,"You use weird euphemisms, Boss."
468,undefined,undefined,dialogue,Dana,...anyway.
469,undefined,undefined,dialogue,Dana,I find it hard to believe that Gil will find a job after all this.
470,undefined,undefined,dialogue,Jill,...just who is Gil?
471,undefined,undefined,dialogue,Dana,I have an idea of who he is... but I'm still putting pieces together.
472,undefined,undefined,dialogue,Dana,"Anyway, back to work. Imminent closure is no excuse to slack off."
473,undefined,undefined,dialogue,Jill,Yessir!
474,undefined,undefined,dialogue,Gillian,...
475,undefined,undefined,dialogue,Gillian,"...you guys do know I can hear you, right?"
476,undefined,undefined,dialogue,Stella,This place looks familiar...
477,undefined,undefined,dialogue,Stella,"Excuse me, is this the... VA-11 Hall-A bar?"
478,undefined,undefined,dialogue,Jill,It is indeed. Welcome to Valhalla.
479,undefined,undefined,dialogue,Stella,"...oh god, what is Sei planning now?"
480,undefined,undefined,dialogue,Jill,Excuse me?
481,undefined,undefined,dialogue,Stella,...
482,undefined,undefined,dialogue,Stella,I want a drink whose name was changed after many women protested. Can you get me that?
483,undefined,undefined,dialogue,Jill,Sure.
484,undefined,undefined,dialogue,Jill,Here you go.
485,undefined,undefined,dialogue,Stella,Very nice. Thanks a lot.
486,undefined,undefined,dialogue,Jill,Here you are.
487,undefined,undefined,dialogue,Stella,"*sigh* You just gave up mid way through, didn't you?"
488,undefined,undefined,dialogue,Jill,Eh...
489,undefined,undefined,dialogue,Jill,"So, you know Sei, miss...?"
490,undefined,undefined,dialogue,Stella,I'm Stella Hoshii. My pleasure.
491,undefined,undefined,dialogue,Stella,My name's in the payment registry.
492,undefined,undefined,dialogue,Jill,Stella... Hoshii. Is that right?
493,undefined,undefined,dialogue,Stella,...
494,undefined,undefined,dialogue,Jill,(Why not just tell me directly though?)
495,undefined,undefined,dialogue,Stella,"Yeah. I know her. She's been here before, yes?"
496,undefined,undefined,dialogue,Jill,"Yup. In fact, I'm glad you know her because she left this here last time."
497,undefined,undefined,dialogue,Stella,"...oh, god. So she left her helmet behind, again."
498,undefined,undefined,dialogue,Jill,"Not the first time, huh?"
499,undefined,undefined,dialogue,Stella,Her helmets have been picked up by all sorts of people in the last three months.
500,undefined,undefined,dialogue,Stella,"Valets, nurses, morticians, fire jugglers..."
501,undefined,undefined,dialogue,Stella,"She's been lucky enough to always leave it with people who return it, at least."
502,undefined,undefined,dialogue,Jill,"Whoa, quite a few people."
503,undefined,undefined,dialogue,Stella,Sei's as much of a sociable girl as she is a total klutz.
504,undefined,undefined,dialogue,Stella,At least when she's not being serious. She's very competent when she puts her mind to it.
505,undefined,undefined,dialogue,Jill,I see.
506,undefined,undefined,dialogue,Jill,So did she recommend you this place or...?
507,undefined,undefined,dialogue,Stella,We're meeting here today.
508,undefined,undefined,dialogue,Stella,I can see why she chose this place. It's the kind of place she likes.
509,undefined,undefined,dialogue,Stella,I'm just waiting for her here.
510,undefined,undefined,dialogue,Stella,...
511,undefined,undefined,dialogue,Stella,Hm...
512,undefined,undefined,dialogue,Stella,"Say, is that *Kira* Miki's autograph on that glass?"
513,undefined,undefined,dialogue,Jill,(Seems like the glass is a conversation starter. Nice.)
514,undefined,undefined,dialogue,Jill,"Yeah, it is."
515,undefined,undefined,dialogue,Stella,How did you get it?
516,undefined,undefined,dialogue,Jill,She stopped here yesterday just before the concert.
517,undefined,undefined,dialogue,Stella,REALLY?!
518,undefined,undefined,dialogue,Stella,...I mean...
519,undefined,undefined,dialogue,Stella,She did?
520,undefined,undefined,dialogue,Jill,Yeah. Nice girl.
521,undefined,undefined,dialogue,Stella,Can I see it?
522,undefined,undefined,dialogue,Jill,Sure.
523,undefined,undefined,dialogue,Stella,"Yup, this star-like signature is hers."
524,undefined,undefined,dialogue,Stella,So your name's Jill then?
525,undefined,undefined,dialogue,Jill,Yes.
526,undefined,undefined,dialogue,Stella,Ain't this nice?
527,undefined,undefined,dialogue,Stella,Here you go.
528,undefined,undefined,dialogue,Jill,"Do you like her, Miss Stella?"
529,undefined,undefined,dialogue,Stella,Just call me Stella.
530,undefined,undefined,dialogue,Stella,I do.
531,undefined,undefined,dialogue,Stella,"Whenever you hear her songs, you're filled with so much energy and happiness."
532,undefined,undefined,dialogue,Stella,I heard she even opened with a new version of Shine Spark!
533,undefined,undefined,dialogue,Stella,I'm so vexed that I couldn't purchase a ticket for this one.
534,undefined,undefined,dialogue,Jill,New version?
535,undefined,undefined,dialogue,Stella,"Yes, I heard a leak from the event. It felt more... how to put it... hot blooded."
536,undefined,undefined,dialogue,Jill,I see.
537,undefined,undefined,dialogue,Jill,"(She definitely took the ""Dark"" act too far.)"
538,undefined,undefined,dialogue,Stella,Too bad I couldn't purchase tickets for this one.
539,undefined,undefined,dialogue,Stella,"I mean, they were sold out in minutes!"
540,undefined,undefined,dialogue,Stella,Luckily I could secure a couple for the next time she comes around.
541,undefined,undefined,dialogue,Stella,And I've only listened to a couple of her songs. Honestly.
542,undefined,undefined,dialogue,Stella,"T-They're catchy, I guess. But that's it."
543,undefined,undefined,dialogue,Jill,I see...
544,undefined,undefined,dialogue,Jill,(She's such a bad liar.)
545,undefined,undefined,dialogue,Stella,"Oh, excuse me for a second."
546,undefined,undefined,dialogue,Stella,Hello? Where the hell are you?!
547,undefined,undefined,dialogue,Stella,"Car crash?! Oh, you're helping."
548,undefined,undefined,dialogue,Stella,Will it take long? Alright.
549,undefined,undefined,dialogue,Stella,"Yeah, yeah. Don't worry."
550,undefined,undefined,dialogue,Jill,I take it that was Sei.
551,undefined,undefined,dialogue,Stella,Yes.
552,undefined,undefined,dialogue,Jill,Will you wait for her?
553,undefined,undefined,dialogue,Stella,I will.
554,undefined,undefined,dialogue,Stella,"In the meantime, I feel like having another drink."
555,undefined,undefined,dialogue,Stella,One that was prepared in memory of its creator's dearest friend.
556,undefined,undefined,dialogue,Jill,Alright.
557,undefined,undefined,dialogue,Jill,Is this the one you had in mind?
558,undefined,undefined,dialogue,Stella,"Yes, exactly."
559,undefined,undefined,dialogue,Stella,Thank you.
560,undefined,undefined,dialogue,Jill,Here.
561,undefined,undefined,dialogue,Stella,"Maybe I'm being too cryptic, but you should know these ones already..."
562,undefined,undefined,dialogue,Jill,(She's not wrong...)
563,undefined,undefined,dialogue,Jill,May I ask you something that might be personal?
564,undefined,undefined,dialogue,Stella,"It isn't about my eye, is it?"
565,undefined,undefined,dialogue,Jill,"No, it's not... or at least I don't think so."
566,undefined,undefined,dialogue,Jill,"I don't get to serve many Cat Boomers, so it's something I've been curious about."
567,undefined,undefined,dialogue,Jill,Did you go through the procedure because of a disease or because of the fad?
568,undefined,undefined,dialogue,Stella,"Before I was born, I was diagnosed with Nanomachine Rejection."
569,undefined,undefined,dialogue,Stella,"So, it had to be done. Otherwise, I would've died shortly after birth."
570,undefined,undefined,dialogue,Stella,"I'm a bit on the weak side because of it, though."
571,undefined,undefined,dialogue,Jill,I'm sorry if I overstepped.
572,undefined,undefined,dialogue,Stella,I don't mind.
573,undefined,undefined,dialogue,Stella,It's always nice to dispel the idea that my parents were just into the fad.
574,undefined,undefined,dialogue,Stella,I'd rather not talk about it.
575,undefined,undefined,dialogue,Jill,My deepest apologies then.
576,undefined,undefined,dialogue,Stella,It's fine.
577,undefined,undefined,dialogue,Stella,"You seem to know your drinks, Jill."
578,undefined,undefined,dialogue,Jill,"Well, I guess I've read a bit more than the recipe book."
579,undefined,undefined,dialogue,Stella,Do you like alcohol?
580,undefined,undefined,dialogue,Jill,"Yeah, but not in the usual way. I don't drink that much outside of canned Beer."
581,undefined,undefined,dialogue,Jill,"But their colors, their stories, the way you need to keep them stored, their designs..."
582,undefined,undefined,dialogue,Jill,It sounds a bit silly when I say it out loud.
583,undefined,undefined,dialogue,Stella,Not at all.
584,undefined,undefined,dialogue,Stella,Do you collect them or anything like that?
585,undefined,undefined,dialogue,Jill,"Actually, yeah. I started with my grandpa's collection and have been slowly growing it."
586,undefined,undefined,dialogue,Jill,"It's been hard because of my debts, but I manage, little by little."
587,undefined,undefined,dialogue,Jill,"Do you like alcohol, Stella?"
588,undefined,undefined,dialogue,Stella,"I'm here, right?"
589,undefined,undefined,dialogue,Stella,But I'm normally more of a social drinker.
590,undefined,undefined,dialogue,Stella,"Unless it's with somebody, I don't tend to drink much."
591,undefined,undefined,dialogue,Jill,I see.
592,undefined,undefined,dialogue,Stella,Your co-worker has been acting strange for a while now.
593,undefined,undefined,dialogue,Jill,"Hey Gil, you ok?"
594,undefined,undefined,dialogue,Gillian,"Yeah, I'm just gonna take my break. Seems my allergies have started acting up."
595,undefined,undefined,dialogue,Jill,Allergies?
596,undefined,undefined,dialogue,Jill,...
597,undefined,undefined,dialogue,Stella,"Yeah, yeah. Stare at the cat-eared girl when allergies enter the fray. How classy."
598,undefined,undefined,dialogue,Jill,I said nothing.
599,undefined,undefined,dialogue,Stella,...!
600,undefined,undefined,dialogue,Stella,...
601,undefined,undefined,dialogue,Stella,"S-So, Gil and Jill. isn't that confusing?"
602,undefined,undefined,dialogue,Jill,"Sometimes, yeah."
603,undefined,undefined,dialogue,Sei,Sorry I'm late!!
604,undefined,undefined,dialogue,Jill,Welcome.
605,undefined,undefined,dialogue,Stella,You took your sweet time.
606,undefined,undefined,dialogue,Sei,"Yeah, sorry! Sorry."
607,undefined,undefined,dialogue,Sei,I got caught in rush hour traffic too and figured walking might be faster.
608,undefined,undefined,dialogue,Sei,"Luckily, there was a building with emergency stairs nearby and I climbed down."
609,undefined,undefined,dialogue,Jill,"""Climbed down""?"
610,undefined,undefined,dialogue,Sei,Took an air cab.
611,undefined,undefined,dialogue,Jill,Oh.
612,undefined,undefined,dialogue,Stella,"I would suggest using ground transportation, but I'm happy to see you put safety first."
613,undefined,undefined,dialogue,Sei,"Safety? No, no... flying cars are just way cooler."
614,undefined,undefined,dialogue,Stella,I still don't understand how they don't give you motion sickness.
615,undefined,undefined,dialogue,Sei,"If I find out how I avoid it, you'll be the first to know."
616,undefined,undefined,dialogue,Sei,"Anyway, I'll have whatever she orders next."
617,undefined,undefined,dialogue,Stella,I'd like a drink that was...
618,undefined,undefined,dialogue,Sei,You're at it again? You and your cryptic orders always leaving us with weird stuff.
619,undefined,undefined,dialogue,Stella,"Hey, I expect only the best from whoever serves me."
620,undefined,undefined,dialogue,Stella,They need to be able to answer these kind of orders.
621,undefined,undefined,dialogue,Sei,"Still, I'm sure you're wearing poor Jill here out with that kind of stuff."
622,undefined,undefined,dialogue,Stella,"She's done quite well so far, actually."
623,undefined,undefined,dialogue,Sei,Really?
624,undefined,undefined,dialogue,Jill,Thank you.
625,undefined,undefined,dialogue,Stella,...maybe.
626,undefined,undefined,dialogue,Jill,...
627,undefined,undefined,dialogue,Sei,"Whatever. Please order something normal, would you?"
