line,filename,lines,type,character,text
593,undefined,undefined,dialogue,Dorothy,"When we're being assaulted or the like. That way, the authorities can chase down the attacker."
594,undefined,undefined,dialogue,Dorothy,"It's kind of buggy, though."
595,undefined,undefined,dialogue,Dorothy,"I've heard stories of DFC-72s who marry, get nervous on their wedding night, and BAM!"
596,undefined,undefined,dialogue,Dorothy,Their partners end up spending the honeymoon in jail.
597,undefined,undefined,dialogue,Jamie,I see.
598,undefined,undefined,dialogue,Dorothy,"And besides, I've modded myself so much that if any tracking nanomachines were still being released..."
599,undefined,undefined,dialogue,Dorothy,I'd have to commend their tenacity to be honest.
600,undefined,undefined,dialogue,Dorothy,"There's also this urban myth that those nanomachines help improve performance, but that's just silly."
601,undefined,undefined,dialogue,Dorothy,Now I get to ask you something!
602,undefined,undefined,dialogue,Jamie,"Sure, go ahead."
603,undefined,undefined,dialogue,Dorothy,How much of you is still organic?
604,undefined,undefined,dialogue,Jamie,Just enough that my skin still heals over time.
605,undefined,undefined,dialogue,Dorothy,Come on! You know that's not what I mean!
606,undefined,undefined,dialogue,Jamie,"I'll tell you that and nothing more, young lady."
607,undefined,undefined,dialogue,Dorothy,"Fiiiiiiiiiiiiine, see if I care."
608,undefined,undefined,dialogue,Dorothy,"Honey, I'm going. I'll leave you with the MEANIE."
609,undefined,undefined,dialogue,Jill,"Thank you, please come again."
610,undefined,undefined,dialogue,Jamie,"That girl's something else, huh?"
611,undefined,undefined,dialogue,Jill,She's so earnest about what she does that it's kinda hard not to root for her.
612,undefined,undefined,dialogue,Jill,...she also has no qualms about anything whatsoever and that becomes a problem from time to time.
613,undefined,undefined,dialogue,Gillian,"Okay, I'm done here."
614,undefined,undefined,dialogue,Jill,"Right, I'm gonna go and take my..."
615,undefined,undefined,dialogue,Dana,GIIIIIIIIIL!!! I NEED YOUR GIRLY HANDS FOR A SECOND HERE!!
616,undefined,undefined,dialogue,Gillian,Coming!
617,undefined,undefined,dialogue,Gillian,"Sorry, can you take care of him while I help her?"
618,undefined,undefined,dialogue,Jill,"Sure, no problem."
619,undefined,undefined,dialogue,Jamie,I apologize if I'm taking time from your break.
620,undefined,undefined,dialogue,Jill,"Nah, don't worry. Sorry you'll have to deal with me."
621,undefined,undefined,dialogue,Jamie,"You're no problem, Jill."
622,undefined,undefined,dialogue,Jill,"Yeah, but you usually seem to have a blast when Gil's the one serving you."
623,undefined,undefined,dialogue,Jill,"Anyway, do you want something else?"
624,undefined,undefined,dialogue,Jamie,Can you make me a Marsblast?
625,undefined,undefined,dialogue,Jill,That I can.
626,undefined,undefined,dialogue,Jill,Here.
627,undefined,undefined,dialogue,Jamie,Bitter and mind-numbing. Just like war.
628,undefined,undefined,dialogue,Jill,Have you been to war?
629,undefined,undefined,dialogue,Jamie,"Life's a war we fight every day, Jill."
630,undefined,undefined,dialogue,Jill,So you haven't been to a war.
631,undefined,undefined,dialogue,Jamie,"Not to an official one, at least."
632,undefined,undefined,dialogue,Jill,Here you are.
633,undefined,undefined,dialogue,Jamie,"Wrong astral body, Jill."
634,undefined,undefined,dialogue,Jamie,"You know, years ago I met the lead engineer of the moon cannon."
635,undefined,undefined,dialogue,Jill,What kind of guy was he?
636,undefined,undefined,dialogue,Jamie,A bit cocky. He said he started the project to pick up girls.
637,undefined,undefined,dialogue,Jamie,Apparently he always told them he'd name it after them.
638,undefined,undefined,dialogue,Jamie,Seems it was *this* close to being called the Simonetta cannon instead of the Selene cannon.
639,undefined,undefined,dialogue,Jill,Huh...
640,undefined,undefined,dialogue,Jill,That one poem about it would've been pretty weird like that.
641,undefined,undefined,dialogue,Jill,"""Under the ever-vigilant eye of Simonetta"" doesn't have the same ring to it."
642,undefined,undefined,dialogue,Jamie,Mercury... it was such a mystical metal ages ago.
643,undefined,undefined,dialogue,Jill,"Well, if you saw a liquid that's all silvery and shiny, you'd think there's something mystical about it."
644,undefined,undefined,dialogue,Jill,I think there was a Chinese emperor that died from drinking mercury mixed with powdered jade.
645,undefined,undefined,dialogue,Jamie,"That would cause liver failure, mercury poisoning, and brain death."
646,undefined,undefined,dialogue,Jill,"...you know a lot about toxicology, don't you?"
647,undefined,undefined,dialogue,Jamie,Just enough.
648,undefined,undefined,dialogue,Jill,Here.
649,undefined,undefined,dialogue,Jamie,...
650,undefined,undefined,dialogue,Jill,(No comments?)
651,undefined,undefined,dialogue,Jill,"Hey, are there many gun-for-hire types in this city?"
652,undefined,undefined,dialogue,Jamie,"Not really. There's maybe two girls and three guys, myself included. Why?"
653,undefined,undefined,dialogue,Jill,"Yesterday, there was this client talking about how a White Knight killed his daughter."
654,undefined,undefined,dialogue,Jill,"Said he sent someone to ""take care"" of the guy. That the hire brought back the guy's head."
655,undefined,undefined,dialogue,Jill,"So, I wanted to know if it sounds familiar to you."
656,undefined,undefined,dialogue,Jamie,Hm... can you give me the guy's name?
657,undefined,undefined,dialogue,Jill,I'd rather not. No offense.
658,undefined,undefined,dialogue,Jamie,None taken.
659,undefined,undefined,dialogue,Jamie,I don't behead my targets - it's too messy.
660,undefined,undefined,dialogue,Jamie,"If they ask me for its head, I generally just give them the whole body."
661,undefined,undefined,dialogue,Jamie,But that story sounds familiar...
662,undefined,undefined,dialogue,Jamie,I think I know the guy that handled that job.
663,undefined,undefined,dialogue,Jamie,"If it's who I think it is, then it's a fellow who goes by ""Sanders""."
664,undefined,undefined,dialogue,Jill,Sanders...
665,undefined,undefined,dialogue,Jill,"Now that I think about it, Jamie's not your real name, is it?"
666,undefined,undefined,dialogue,Jamie,"To tell you the truth, I don't remember my real name."
667,undefined,undefined,dialogue,Jamie,It might as well be Jamie for all I know.
668,undefined,undefined,dialogue,Jill,"Oh, I see..."
669,undefined,undefined,dialogue,Jill,...
670,undefined,undefined,dialogue,Jamie,Something wrong?
671,undefined,undefined,dialogue,Jill,I just realized how easy it is for me to get ahold of dangerous information from dangerous people.
672,undefined,undefined,dialogue,Jill,No offense.
673,undefined,undefined,dialogue,Jamie,None taken.
674,undefined,undefined,dialogue,Jamie,It was easy because I know you won't do anything with it.
675,undefined,undefined,dialogue,Jamie,I wouldn't be so open about that with anyone else.
676,undefined,undefined,dialogue,Jill,You flatter m-...
677,undefined,undefined,dialogue,Jamie,Something wrong?
678,undefined,undefined,dialogue,Jill,I was just thinking how troublesome it'd be for common people to get rid of a human head.
679,undefined,undefined,dialogue,Jill,"(Shit, he might have lied after all...)"
680,undefined,undefined,dialogue,Jamie,...?
681,undefined,undefined,dialogue,Jill,There's something I've been wondering for a while now.
682,undefined,undefined,dialogue,Jamie,What could that be?
683,undefined,undefined,dialogue,Jill,First it was how a professional assassin could be so polite and pleasant to be around...
684,undefined,undefined,dialogue,Jill,...but I guess your line of work doesn't have to have any bearing on your personality.
685,undefined,undefined,dialogue,Jamie,Thanks a lot.
686,undefined,undefined,dialogue,Jill,What I've often wondered about is how you can be so calm here?
687,undefined,undefined,dialogue,Jill,Aren't you worried about police or the like?
688,undefined,undefined,dialogue,Jamie,"Well... first of all, I try to keep everything as clean as possible."
689,undefined,undefined,dialogue,Jamie,"Second, I don't come here looking for trouble, so I don't raise suspicion."
690,undefined,undefined,dialogue,Jamie,"And finally, you can thank your boss for easing my mind about other folks."
691,undefined,undefined,dialogue,Jill,My boss?
692,undefined,undefined,dialogue,Jamie,I've seen what she's done. I feel safe here.
693,undefined,undefined,dialogue,Jamie,She could take care of things if I went haywire.
694,undefined,undefined,dialogue,Jill,Haywire? You?
695,undefined,undefined,dialogue,Jamie,Don't mind that.
696,undefined,undefined,dialogue,Jill,(Hard not to mind it if you just said...)
697,undefined,undefined,dialogue,Jill,Hm...
698,undefined,undefined,dialogue,Jill,"You... wouldn't happen to know how she got her mechanical arm, would you?"
699,undefined,undefined,dialogue,Jamie,I heard she lost her original fighting a cyborg wrestler that had gone rogue.
700,undefined,undefined,dialogue,Jamie,"Just a rumor, though."
701,undefined,undefined,dialogue,Jill,"Damn... I still don't know, then."
702,undefined,undefined,dialogue,Jamie,Have you tried asking her?
703,undefined,undefined,dialogue,Jill,"She told me ""It's more interesting if it's left a mystery."""
704,undefined,undefined,dialogue,Jill,Which leads me to believe that she might have started some of the rumors herself.
705,undefined,undefined,dialogue,Jamie,They're believable because she's her.
706,undefined,undefined,dialogue,Jill,Maybe I'll see her in action one day.
707,undefined,undefined,dialogue,Jamie,You should. It's quite the show.
708,undefined,undefined,dialogue,Gillian,"Good news, Jill. The helmet came off and you can take your break."
709,undefined,undefined,dialogue,Jill,Finally.
710,undefined,undefined,dialogue,Jill,"It's always a pleasure, Jamie."
711,undefined,undefined,dialogue,Jamie,"Thank you, Jill."
712,undefined,undefined,dialogue,Jill,"Boss, break!"
713,undefined,undefined,dialogue,Dana,Alright!
714,undefined,undefined,dialogue,Dana,"You could take a couple minutes more, you know?"
715,undefined,undefined,dialogue,Jill,"I'm fine, thanks."
716,undefined,undefined,dialogue,Jill,How did you get the helmet off?
717,undefined,undefined,dialogue,Dana,Turns out the release button was jammed with ashes.
718,undefined,undefined,dialogue,Dana,Whoever owns that helmet made sure to use it to the point of voiding the warranty.
719,undefined,undefined,dialogue,Dana,"Keep it safe in case she comes back, okay?"
720,undefined,undefined,dialogue,Jill,Sure.
721,undefined,undefined,dialogue,Dana,"Now, take it away from me before I feel compelled to put it on again."
722,undefined,undefined,dialogue,Jill,R-Right...
723,undefined,undefined,dialogue,*Kira* Miki,Yes! It's open. Great!
724,undefined,undefined,dialogue,Jill,Welcome to Valhalla.
725,undefined,undefined,dialogue,*Kira* Miki,Good evening. Um... what kind of place is this?
726,undefined,undefined,dialogue,*Kira* Miki,Did I step into some kind of afterlife?
727,undefined,undefined,dialogue,Jill,Do you often enter places without knowing what they are?
728,undefined,undefined,dialogue,*Kira* Miki,Sorta. Kinda. Yeah?
729,undefined,undefined,dialogue,Jill,Well. This is a bar.
730,undefined,undefined,dialogue,*Kira* Miki,A bar? Nice! Nice!
731,undefined,undefined,dialogue,Jill,What can I get you?
732,undefined,undefined,dialogue,*Kira* Miki,"I don't know... I don't drink that much, to be honest."
733,undefined,undefined,dialogue,*Kira* Miki,What do you recommend for me?
734,undefined,undefined,dialogue,Jill,What do you normally enjoy?
735,undefined,undefined,dialogue,*Kira* Miki,I like tea.
736,undefined,undefined,dialogue,Jill,That's... not something I can work with.
737,undefined,undefined,dialogue,Jill,What about flavors?
738,undefined,undefined,dialogue,*Kira* Miki,Bitter but not too bitter?
739,undefined,undefined,dialogue,*Kira* Miki,Sorry if it's too confusing.
740,undefined,undefined,dialogue,Jill,(Something bitter but not too much. Maybe something bitter and girly?)
741,undefined,undefined,dialogue,Jill,Let me see what I can get you.
742,undefined,undefined,dialogue,Jill,Try this.
743,undefined,undefined,dialogue,*Kira* Miki,"Yup, this'll do just fine. Thanks!"
744,undefined,undefined,dialogue,Jill,"Here, try this."
745,undefined,undefined,dialogue,*Kira* Miki,*cough* A bit too strong for me.
746,undefined,undefined,dialogue,Jill,Here you go.
747,undefined,undefined,dialogue,*Kira* Miki,"Hey, I like this one!"
748,undefined,undefined,dialogue,*Kira* Miki,But didn't you say you didn't have tea?
749,undefined,undefined,dialogue,Jill,"Well, it's not freshly made tea or anything like that."
750,undefined,undefined,dialogue,Jill,Here.
751,undefined,undefined,dialogue,*Kira* Miki,This doesn't taste like what I had in mind.
752,undefined,undefined,dialogue,*Kira* Miki,"But then again, I wasn't clear with the order. Sorry."
753,undefined,undefined,dialogue,Jill,...
754,undefined,undefined,dialogue,Jill,"You don't look like you're from around here. What brought you by, Miss...?"
755,undefined,undefined,dialogue,*Kira* Miki,I'm the star that always shines in the dark night sky!
756,undefined,undefined,dialogue,*Kira* Miki,I'm the glow that will guide you through your sorrow!
757,undefined,undefined,dialogue,*Kira* Miki,I'm the northern light that will show you your dreams!
758,undefined,undefined,dialogue,*Kira* Miki,I'm *Kira* Miki!
759,undefined,undefined,dialogue,Jill,S-So... Should I call you Miss Miki or Miss Kira?
760,undefined,undefined,dialogue,*Kira* Miki,"No, you're not getting it, I'm just *Kira* Miki."
761,undefined,undefined,dialogue,*Kira* Miki,"Here, let me help you. I'll say Kira and you say Miki, okay?"
762,undefined,undefined,dialogue,Jill,Okay...
763,undefined,undefined,dialogue,*Kira* Miki,Kira!
764,undefined,undefined,dialogue,Jill,...M-Miki.
765,undefined,undefined,dialogue,*Kira* Miki,No no no no! Put more spirit into it!
766,undefined,undefined,dialogue,*Kira* Miki,Kira!
767,undefined,undefined,dialogue,Jill,M-Miki.
768,undefined,undefined,dialogue,*Kira* Miki,Almost there!
769,undefined,undefined,dialogue,*Kira* Miki,Kira!
770,undefined,undefined,dialogue,Jill,Miki.
771,undefined,undefined,dialogue,*Kira* Miki,Kira!
772,undefined,undefined,dialogue,Jill,Miki!
773,undefined,undefined,dialogue,*Kira* Miki,Kira!!
774,undefined,undefined,dialogue,Jill & Gillian,Miki!!
775,undefined,undefined,dialogue,*Kira* Miki,Kira!!
776,undefined,undefined,dialogue,Everyone,Miki!!
777,undefined,undefined,dialogue,*Kira* Miki,That's it! Are you feeling it?
778,undefined,undefined,dialogue,*Kira* Miki,Kira!!!
779,undefined,undefined,dialogue,Everyone,Miki!!!
780,undefined,undefined,dialogue,*Kira* Miki,Kira!!!
781,undefined,undefined,dialogue,Everyone,Miki!!!
782,undefined,undefined,dialogue,*Kira* Miki,Kira!!!
783,undefined,undefined,dialogue,Everyone,Miki!!!!
784,undefined,undefined,dialogue,*Kira* Miki,And don't you ever forget it!
785,undefined,undefined,dialogue,"Jill, Gillian, Dana, & Jamie",...
786,undefined,undefined,dialogue,Dana,What the hell am I doing out here?
787,undefined,undefined,dialogue,Gillian,"Um... where were we, Jamie?"
788,undefined,undefined,dialogue,Jamie,"R-Right, I was telling you..."
789,undefined,undefined,dialogue,Jill,Wow. You're good.
790,undefined,undefined,dialogue,*Kira* Miki,Thank you!
791,undefined,undefined,dialogue,*Kira* Miki,It's nice to know I still have it.
792,undefined,undefined,dialogue,*Kira* Miki,Especially since I have a concert in a bit.
793,undefined,undefined,dialogue,Jill,Concert?
794,undefined,undefined,dialogue,Jill,"Wait, you're the Lilim that's putting on a concert tonight?"
795,undefined,undefined,dialogue,*Kira* Miki,I'm ONE Lilim who is putting on a concert tonight. I don't know if I'm the same Lilim you're looking for.
796,undefined,undefined,dialogue,Jill,And what are you doing all the way down here?
797,undefined,undefined,dialogue,*Kira* Miki,"Well, they were making last preparations for the concert so I snuck out."
798,undefined,undefined,dialogue,*Kira* Miki,"My producer is always obnoxious while that's going on, so I just decided to leave."
799,undefined,undefined,dialogue,*Kira* Miki,I saw one of the concert's posters outside and decided to check this place.
800,undefined,undefined,dialogue,Jill,(Just that? Isn't that a bit... dangerous?)
801,undefined,undefined,dialogue,Jill,Won't your producer be mad when you go back?
802,undefined,undefined,dialogue,*Kira* Miki,"He will, but it's not the first time I've done this."
803,undefined,undefined,dialogue,*Kira* Miki,And he still needs me to do the concert anyway.
804,undefined,undefined,dialogue,Jill,I-I see...
805,undefined,undefined,dialogue,Jill,How big is the concert?
806,undefined,undefined,dialogue,*Kira* Miki,"We planned for a bit over 100,000 people and sold out fast."
807,undefined,undefined,dialogue,*Kira* Miki,"So, we managed to secure ourselves another show in a couple of weeks."
808,undefined,undefined,dialogue,Jill,"Oh, that's nice."
809,undefined,undefined,dialogue,*Kira* Miki,"Yeah. I may not have as many fans as other performers, but mine are very loyal, and that's nice."
810,undefined,undefined,dialogue,Jill,"(Over 100,000 is not many? Then what exactly is?)"
811,undefined,undefined,dialogue,Jill,"Hold on. Then, based on your little demonstration from before, I should call you ""Ms. Miki"", right?"
812,undefined,undefined,dialogue,*Kira* Miki,You don't get it! Let's start from the top.
813,undefined,undefined,dialogue,Jill,I'll just call you Ms. Idol then.
814,undefined,undefined,dialogue,*Kira* Miki,Oh! I like that.
815,undefined,undefined,dialogue,*Kira* Miki,"Hey, do you have anything... soft?"
816,undefined,undefined,dialogue,Jill,Soft? As in Alcohol-free?
817,undefined,undefined,dialogue,*Kira* Miki,"No, I meant soft as in soft."
818,undefined,undefined,dialogue,Jill,Soft...?
819,undefined,undefined,dialogue,Jill,L-Let's see what I can get you.
820,undefined,undefined,dialogue,Jill,Try this.
821,undefined,undefined,dialogue,*Kira* Miki,"Yeah, this'll do it. Thanks!"
822,undefined,undefined,dialogue,*Kira* Miki,"Hey, have you considered being more theatrical when mixing drinks?"
823,undefined,undefined,dialogue,Jill,Eh?
824,undefined,undefined,dialogue,*Kira* Miki,"Yeah, you know. Like spinning bottles and lighting drinks on fire. That kind of stuff."
825,undefined,undefined,dialogue,Jill,"When I was in college, I tried going to a party once."
826,undefined,undefined,dialogue,Jill,The bartender who tried those tricks gave me a nasty bump on the forehead when the bottle slipped his hand.
827,undefined,undefined,dialogue,Jill,Those kind of theatrics usually feel pointless and seem to slow down the process of actually making a drink.
828,undefined,undefined,dialogue,*Kira* Miki,"Yeah, but never underestimate the power of putting on a good show."
829,undefined,undefined,dialogue,*Kira* Miki,"It can feel incredible and be very rewarding, you know?"
830,undefined,undefined,dialogue,Jill,I'll keep it in mind.
831,undefined,undefined,dialogue,Jill,What about this?
832,undefined,undefined,dialogue,*Kira* Miki,It isn't what I had in mind for soft...
833,undefined,undefined,dialogue,*Kira* Miki,But it'll work juuuuuuuust fine. Thanks!
834,undefined,undefined,dialogue,Jill,"(Soft is a bit vague, though.)"
835,undefined,undefined,dialogue,Jill,Here.
836,undefined,undefined,dialogue,*Kira* Miki,"Aw man, this isn't soft."
837,undefined,undefined,dialogue,*Kira* Miki,I'm gonna reek of alcohol.
838,undefined,undefined,dialogue,Jill,(You should've thought about that before ordering drinks in a godforsaken bar.)
839,undefined,undefined,dialogue,Jill,We have mints that can help you with that.
840,undefined,undefined,dialogue,Jill,But it would've been easier if you'd just said what you needed in your drink.
841,undefined,undefined,dialogue,*Kira* Miki,"Oh, I'll keep it in mind."
842,undefined,undefined,dialogue,*Kira* Miki,Hmhm...
843,undefined,undefined,dialogue,*Kira* Miki,"Hey, is this glass important?"
844,undefined,undefined,dialogue,Jill,Depends on why you're asking.
845,undefined,undefined,dialogue,*Kira* Miki,Do you want me to sign it?
846,undefined,undefined,dialogue,Jill,"Oh. Sure, I guess?"
847,undefined,undefined,dialogue,*Kira* Miki,No guessing! Are you sure or not?
848,undefined,undefined,dialogue,Jill,Yeah. Do as you please.
849,undefined,undefined,dialogue,*Kira* Miki,"Okay, then. Who should I make it out to?"
850,undefined,undefined,dialogue,Jill,(Maybe for my boss? I wonder if Gil would like it though.)
851,undefined,undefined,dialogue,*Kira* Miki,"Your name, girl!"
852,undefined,undefined,dialogue,Jill,Oh! For Jill then.
853,undefined,undefined,dialogue,*Kira* Miki,"""For Jill. Never lose your star. From *Kira* Miki."""
854,undefined,undefined,dialogue,Jill,"Oh, that's a pretty autograph."
855,undefined,undefined,dialogue,*Kira* Miki,Thanks!
856,undefined,undefined,dialogue,Jill,"No, thank you."
857,undefined,undefined,dialogue,Jill,"So, tell me more about this concert of yours."
858,undefined,undefined,dialogue,*Kira* Miki,"Well, we're promoting my new single. It's called Shine Spark."
859,undefined,undefined,dialogue,*Kira* Miki,"I say that, but people still look forward to my old single, ""Your Love Is a Drug""."
860,undefined,undefined,dialogue,*Kira* Miki,"I'm worried I might become a one-note star, you know?"
861,undefined,undefined,dialogue,*Kira* Miki,"*ahem* Anyways, the tour is called Shining Star and we've been traveling the whole continent."
862,undefined,undefined,dialogue,*Kira* Miki,We sold out of tickets fast! So we decided to give an encore concert after all others are done.
863,undefined,undefined,dialogue,Jill,"Ah, nice."
864,undefined,undefined,dialogue,*Kira* Miki,But I'm not gonna bore you with details you'll find in tomorrow's newspapers anyways.
865,undefined,undefined,dialogue,*Kira* Miki,I got this awesome dress that looks all cat-like.
866,undefined,undefined,dialogue,*Kira* Miki,"My hairdresser, Agnes, came up with a hairstyle that makes me look like I have cat ears and all!"
867,undefined,undefined,dialogue,Jill,What do cats have to do with stars?
868,undefined,undefined,dialogue,*Kira* Miki,Nothing! I just like cats.
869,undefined,undefined,dialogue,*Kira* Miki,My producer suggested a bunny though.
870,undefined,undefined,dialogue,Jill,I see...
871,undefined,undefined,dialogue,*Kira* Miki,"You know, if I hadn't ended up on stage singing, I'd probably be the one planning the pyrotechnics."
872,undefined,undefined,dialogue,*Kira* Miki,"When you enter the stage and the sparks start flying... that's magical, you know?"
873,undefined,undefined,dialogue,Jill,You've never burned yourself with those fireworks? I've heard ugly stories from other musicians.
874,undefined,undefined,dialogue,*Kira* Miki,"No, not yet. I singed my hair once, but I just went for something short for a bit."
875,undefined,undefined,dialogue,*Kira* Miki,People seemed to love it. I should go back to it sometime.
876,undefined,undefined,dialogue,Jill,(Um... how do Lilim get longer hair?)
877,undefined,undefined,dialogue,Jill,"I'm guessing someone with as many fans as you has their fair share of stalkers, right?"
878,undefined,undefined,dialogue,*Kira* Miki,"Well, there are two kinds of people that obsess over me."
879,undefined,undefined,dialogue,*Kira* Miki,"There are the shy ones that follow me everywhere, hiding just out of sight."
880,undefined,undefined,dialogue,*Kira* Miki,And then there's my fanclub.
881,undefined,undefined,dialogue,Jill,What's the difference between them?
882,undefined,undefined,dialogue,*Kira* Miki,"The fanclub follows me around a lot too, but they usually keep a distance."
883,undefined,undefined,dialogue,*Kira* Miki,"Actually, I think they're outside waiting for me right now."
884,undefined,undefined,dialogue,Jill,I-I see...
885,undefined,undefined,dialogue,*Kira* Miki,They're also very organized. They'd make pretty good soldiers.
886,undefined,undefined,dialogue,*Kira* Miki,"The others, the stalkers, are a bit sneakier and don't act in groups."
887,undefined,undefined,dialogue,Jill,"I'm guessing those stalkers must be bothersome, huh..."
888,undefined,undefined,dialogue,*Kira* Miki,"Actually, they're not that bad."
889,undefined,undefined,dialogue,*Kira* Miki,Stalkers are nice when you get used to them.
890,undefined,undefined,dialogue,*Kira* Miki,I remember one once protected me from being mugged.
891,undefined,undefined,dialogue,*Kira* Miki,There's another that breaks into my house once a week to make me breakfast.
892,undefined,undefined,dialogue,Jill,(And she fails to see the problem?)
893,undefined,undefined,dialogue,*Kira* Miki,I just wish they'd leave my underwear drawer the same way they find it.
894,undefined,undefined,dialogue,*Kira* Miki,"I take pride in how neatly I organize my underwear, you know?"
895,undefined,undefined,dialogue,Jill,I take pride in my old liquor collection. I guess it's the same.
896,undefined,undefined,dialogue,Jill,"(No, wait. It isn't!)"
897,undefined,undefined,dialogue,*Kira* Miki,"Yeah! You get me, Jill."
898,undefined,undefined,dialogue,Jill,...
899,undefined,undefined,dialogue,*Kira* Miki,"Okay, one more drink before I go."
900,undefined,undefined,dialogue,*Kira* Miki,"By now, the stage should be all organized, so the fallout should have settled."
901,undefined,undefined,dialogue,Jill,Isn't it a bit late for a concert?
902,undefined,undefined,dialogue,*Kira* Miki,It's part of my gimmick. I always make concerts that go from night till dawn.
903,undefined,undefined,dialogue,*Kira* Miki,"In this one, I'm supposed to close with a song called Sunshine Stone."
904,undefined,undefined,dialogue,*Kira* Miki,If everything goes as planned and the weather forecast is accurate...
