line,filename,lines,type,character,text
933,undefined,undefined,dialogue,Gillian,Then there was the incident with the TV...
934,undefined,undefined,dialogue,Dana,"I'll admit my fault with the others, but the TV incident was NOT my fault."
935,undefined,undefined,dialogue,Dana,The assembly instructions for that stand should have labeled their Z and S better.
936,undefined,undefined,dialogue,Dana,You saw what happened when I switched the S2 piece with the 5Z one.
937,undefined,undefined,dialogue,Gillian,Still... Jill's onto something here.
938,undefined,undefined,dialogue,Dana,"*ahem* Yes, she is."
939,undefined,undefined,dialogue,Dana,"Now, go clean the dishes and you can leave for today."
940,undefined,undefined,dialogue,Jill,I like to think she'll make an effort now to avoid getting stuck in things.
941,undefined,undefined,dialogue,Gillian,I want to believe.
942,undefined,undefined,dialogue,Jill,Hm... hmhmhm...