line,filename,lines,type,character,text
638,undefined,undefined,dialogue,Kim,*sniff* I should've come to thank you earlier. I owed you that at least.
639,undefined,undefined,dialogue,Dana,Don't worry. Just go out and be happy.
640,undefined,undefined,dialogue,Dana,"You have a second chance, so use it as best as you can."
641,undefined,undefined,dialogue,Kim,I will!
642,undefined,undefined,dialogue,Kim,"I'll be leaving. Happy New Year, Jill! And thank you again."
643,undefined,undefined,dialogue,Jill,Please come again.
644,undefined,undefined,dialogue,Jill,So... a couple of weeks ago I read some news about a woman saving a suicidal girl. Catching her mid-air.
645,undefined,undefined,dialogue,Jill,"Would you know something about that, Boss?"
646,undefined,undefined,dialogue,Dana,"Maybe, maybe not."
647,undefined,undefined,dialogue,Dana,Whoever it was probably just did it because it was the right thing to do.