line,filename,lines,type,character,text
0,script14.txt,647,META,undefined,undefined
2,undefined,undefined,dialogue,Jill,*yawn* G'evening.
3,undefined,undefined,dialogue,Dana,"Hey, Jill! Gil is in the back sorting an ingredients shipment and I've got things to do, the dog's in charge, okay? Bye!"
4,undefined,undefined,dialogue,Jill,...what?
5,undefined,undefined,dialogue,Jill,"Wait, the dog what?!"
6,undefined,undefined,dialogue,Rad Shiba,"Okay, first order: pet me."
7,undefined,undefined,dialogue,Jill,No.
8,undefined,undefined,dialogue,Rad Shiba,Pet me.
9,undefined,undefined,dialogue,Jill,No.
10,undefined,undefined,dialogue,Rad Shiba,I'm in charge and I want you to pet me.
11,undefined,undefined,dialogue,Jill,...
12,undefined,undefined,dialogue,Jill,Time to mix drinks and change lives.
13,undefined,undefined,dialogue,Rad Shiba,Hey J!
14,undefined,undefined,dialogue,Jill,Won't pet you.
15,undefined,undefined,dialogue,Rad Shiba,You'll pet me sooner or later. They all do.
16,undefined,undefined,dialogue,Jill,Won't!
17,undefined,undefined,dialogue,Rad Shiba,Will!
18,undefined,undefined,dialogue,Gillian,You called?
19,undefined,undefined,dialogue,Jill,"He said will, not Gil."
20,undefined,undefined,dialogue,Gillian,Aaaaah.
21,undefined,undefined,dialogue,Gillian,...
22,undefined,undefined,dialogue,Gillian,Who the hell is Will?
23,undefined,undefined,dialogue,Jill,Nobody!
24,undefined,undefined,dialogue,Gillian,Don't be rude with poor Will!
25,undefined,undefined,dialogue,Jill,There's no Will!
26,undefined,undefined,dialogue,Rad Shiba,Do you need me to psyche you up then?
27,undefined,undefined,dialogue,Jill,SHUT UUUUP!
28,undefined,undefined,dialogue,Gillian,Who? Me or Will?
29,undefined,undefined,dialogue,Jill,AAAAAAAAAAAAAGH!
30,undefined,undefined,dialogue,Jill,You go back to whatever you were doing.
31,undefined,undefined,dialogue,Gillian,...alright.
32,undefined,undefined,dialogue,Jill,And you... standby!
33,undefined,undefined,dialogue,Rad Shiba,Only if you pet me.
34,undefined,undefined,dialogue,Jill,GO!
35,undefined,undefined,dialogue,Jill,...
36,undefined,undefined,dialogue,Jill,...the fuck just happened?
37,undefined,undefined,dialogue,Virgilio,"Well, aren't we spirited today?"
38,undefined,undefined,dialogue,Jill,Welcome to Valha-...
39,undefined,undefined,dialogue,Jill,Virgilio?
40,undefined,undefined,dialogue,Virgilio,Why do you sound so weirded out?
41,undefined,undefined,dialogue,Jill,You didn't show up with a... bombastic soliloquy.
42,undefined,undefined,dialogue,Virgilio,"Well, putting up an act can be tiring, you know?"
43,undefined,undefined,dialogue,Jill,"So it's all an act, then?"
44,undefined,undefined,dialogue,Virgilio,Wasn't it obvious?
45,undefined,undefined,dialogue,Jill,I guess...
46,undefined,undefined,dialogue,Virgilio,Would you mind getting me a Bleeding Jane?
47,undefined,undefined,dialogue,Jill,Sure.
48,undefined,undefined,dialogue,Jill,A Bleeding Jane.
49,undefined,undefined,dialogue,Virgilio,"Yes, this is just the thing."
50,undefined,undefined,dialogue,Jill,Here.
51,undefined,undefined,dialogue,Virgilio,This isn't a Bleeding Jane.
52,undefined,undefined,dialogue,Jill,"Uh... actually my name is Jane and I'm bleeding, so... um..."
53,undefined,undefined,dialogue,Virgilio,"Hahaha! You can be quite creative with your excuses, Miss Bartender."
54,undefined,undefined,dialogue,Jill,So... tired of putting on an act. Care to explain?
55,undefined,undefined,dialogue,Virgilio,It's a long story. And I'd honestly rather not talk about it right now.
56,undefined,undefined,dialogue,Jill,"Fair enough. What made you change your mind, though?"
57,undefined,undefined,dialogue,Virgilio,"Well, for one thing, it's safer for me now. The pompous buffoon act was mostly a way to avoid raising suspicion."
58,undefined,undefined,dialogue,Jill,Safer? There's a word that's been losing meaning lately.
59,undefined,undefined,dialogue,Jill,Wait... THAT was your way of avoiding suspicion?
60,undefined,undefined,dialogue,Virgilio,Yes.
61,undefined,undefined,dialogue,Jill,"...you do know how weird that sounds, right?"
62,undefined,undefined,dialogue,Virgilio,It sounds weird?
63,undefined,undefined,dialogue,Jill,"You try not to raise suspicion, but you act in a bombastic manner that screams you're there."
64,undefined,undefined,dialogue,Virgilio,And everyone dismisses the fool as a buffoon and moves on.
65,undefined,undefined,dialogue,Jill,...
66,undefined,undefined,dialogue,Jill,...eh?
67,undefined,undefined,dialogue,Virgilio,"I mean, you might be right if I were talking about hiding myself."
68,undefined,undefined,dialogue,Virgilio,But I'm avoiding certain... crowds of people.
69,undefined,undefined,dialogue,Virgilio,"Yes, my behaviour might call everyone's attention."
70,undefined,undefined,dialogue,Virgilio,But then everyone just decides I'm harmless and disregards me.
71,undefined,undefined,dialogue,Virgilio,"And depending on how erratic my actions are, I become harder to read."
72,undefined,undefined,dialogue,Virgilio,Giving me yet another layer of enigma.
73,undefined,undefined,dialogue,Jill,I...
74,undefined,undefined,dialogue,Jill,Huh.
75,undefined,undefined,dialogue,Jill,"Well, congrats. No offense, but I fell right into your plan."
76,undefined,undefined,dialogue,Jill,I just dismissed your actions as those of a fool and moved on.
77,undefined,undefined,dialogue,Jill,You completely fooled me.
78,undefined,undefined,dialogue,Virgilio,Thanks.
79,undefined,undefined,dialogue,Virgilio,"Say, can you give me something spicy?"
80,undefined,undefined,dialogue,Jill,Sure.
81,undefined,undefined,dialogue,Jill,Here.
82,undefined,undefined,dialogue,Virgilio,Aren't you fascinated by spiciness?
83,undefined,undefined,dialogue,Virgilio,What's spicy for humans might not be spicy for other animals.
84,undefined,undefined,dialogue,Virgilio,"Hell, what's toxic for us might not be for other creatures."
85,undefined,undefined,dialogue,Virgilio,"Do you like spicy things, bartender?"
86,undefined,undefined,dialogue,Jill,"I don't mind them, I guess. But I'm not really a fan."
87,undefined,undefined,dialogue,Virgilio,That neutral stance is actually weird to come across.
88,undefined,undefined,dialogue,Virgilio,Everyone either loves spicy things or hates them with passion.
89,undefined,undefined,dialogue,Jill,Do you like it?
90,undefined,undefined,dialogue,Virgilio,"Lots. Not only in regards to painfully spicy things, but also the way mild or slight spice adds to a meal."
91,undefined,undefined,dialogue,Virgilio,I've always had this dream of opening a curry stand.
92,undefined,undefined,dialogue,Virgilio,"As things are, I might actually pursue that dream."
93,undefined,undefined,dialogue,Jill,Let me know if you do. I haven't had curry in ages now.
94,undefined,undefined,dialogue,Jill,Here.
95,undefined,undefined,dialogue,Virgilio,Not spicy enough.
96,undefined,undefined,dialogue,Virgilio,I hate it when things aren't spicy enough.
97,undefined,undefined,dialogue,Jill,"It burns the tongue a bit, though."
98,undefined,undefined,dialogue,Virgilio,Not the same thing.
99,undefined,undefined,dialogue,Virgilio,"Hey, bartender..."
100,undefined,undefined,dialogue,Jill,Call me Jill.
101,undefined,undefined,dialogue,Virgilio,I wanted to apologize.
102,undefined,undefined,dialogue,Jill,Hm?
103,undefined,undefined,dialogue,Virgilio,"You put up with me all this time without lashing out. I should apologize for my behaviour, and thank you at that."
104,undefined,undefined,dialogue,Jill,Don't worry. I actually feel like I was too rude to you last time you came.
105,undefined,undefined,dialogue,Jill,"Granted, you came at a really bad time, but..."
106,undefined,undefined,dialogue,Jill,I should be the one apologizing. You're a client after all.
107,undefined,undefined,dialogue,Virgilio,"Well, don't. I'm actually surprised that nobody else had violently lashed out at me yet."
108,undefined,undefined,dialogue,Jill,You're making me curious as to who you really are though.
109,undefined,undefined,dialogue,Jill,Is Virgilio even your real name?
110,undefined,undefined,dialogue,Virgilio,"It might be, it might not."
111,undefined,undefined,dialogue,Jill,...sometimes I wonder if I'm a magnet for people who hide their identities and sordid pasts.
112,undefined,undefined,dialogue,Jill,"Gil, Jamie, you..."
113,undefined,undefined,dialogue,Virgilio,Um... did you say something?
114,undefined,undefined,dialogue,Jill,Just rambling. Pay me no mind.
115,undefined,undefined,dialogue,Jill,"So, tell me. Why a steampunk museum?"
116,undefined,undefined,dialogue,Virgilio,I've always liked the steampunk aesthetic. And that whole art movement is fascinating.
117,undefined,undefined,dialogue,Virgilio,It's always interesting to see how certain currents mirror certain cultures.
118,undefined,undefined,dialogue,Virgilio,"And in this case, how steampunk takes from Victorian culture."
119,undefined,undefined,dialogue,Virgilio,Non-Victorian examples are too few and far between.
120,undefined,undefined,dialogue,Jill,Interesting.
121,undefined,undefined,dialogue,Virgilio,...I also needed a job and the director just so happened to be a friend of mine.
122,undefined,undefined,dialogue,Jill,Of course.
123,undefined,undefined,dialogue,Jill,"Now that I think about it, how did you find this bar?"
124,undefined,undefined,dialogue,Virgilio,I was... avoiding some chaps and came to this alley.
125,undefined,undefined,dialogue,Jill,Huh... again.
126,undefined,undefined,dialogue,Virgilio,"""Again""?"
127,undefined,undefined,dialogue,Jill,"In my time here, I've heard ""avoided people and ended up here"" enough times to make me believe..."
128,undefined,undefined,dialogue,Jill,That the original owner built the bar here thinking about the runaway public.
129,undefined,undefined,dialogue,Virgilio,You make me sound like a criminal.
130,undefined,undefined,dialogue,Jill,You're not helping.
131,undefined,undefined,dialogue,Jill,"The expression ""runaway"" doesn't just mean people escaping the law though."
132,undefined,undefined,dialogue,Jill,We've had people avoiding stalkers or solicitors.
133,undefined,undefined,dialogue,Jill,I've seen people more shocked by an insistent salesman than a shady figure.
134,undefined,undefined,dialogue,Jill,Maybe because the salesman is a more active predator? I don't know.
135,undefined,undefined,dialogue,Jill,A troublesome part of the city right near the shopping district.
136,undefined,undefined,dialogue,Jill,Let them know there's a bar and they'll come.
137,undefined,undefined,dialogue,Jill,...sorry. I should stop rambling to myself so much.
138,undefined,undefined,dialogue,Virgilio,I don't mind it.
139,undefined,undefined,dialogue,Virgilio,"...do you think I'm sort of criminal, though?"
140,undefined,undefined,dialogue,Jill,Like I said: you're not helping.
141,undefined,undefined,dialogue,Jill,But for all I know... you might be the buffoon I've seen the other days.
142,undefined,undefined,dialogue,Virgilio,"In any case, can I get something bitter here?"
143,undefined,undefined,dialogue,Jill,On it.
144,undefined,undefined,dialogue,Jill,Here.
145,undefined,undefined,dialogue,Virgilio,This works.
146,undefined,undefined,dialogue,Virgilio,"Do you like coffee, Miss Bartender?"
147,undefined,undefined,dialogue,Jill,"As weird as it may sound from a smoking bartender... no, I don't."
148,undefined,undefined,dialogue,Virgilio,"Well, I get it. It's not for everyone."
149,undefined,undefined,dialogue,Jill,Here you are.
150,undefined,undefined,dialogue,Virgilio,This... isn't bitter.
151,undefined,undefined,dialogue,Jill,Um... because you're the bitter one now!
152,undefined,undefined,dialogue,Jill,...
153,undefined,undefined,dialogue,Jill,Sorry.
154,undefined,undefined,dialogue,Virgilio,Don't be. It wouldn't surprise me if it became force of habit due to my weird orders before.
155,undefined,undefined,dialogue,Virgilio,That Cat Boomer the other day...
156,undefined,undefined,dialogue,Jill,What about her? Still scared of her?
157,undefined,undefined,dialogue,Virgilio,"Not really, but she looks so familiar..."
158,undefined,undefined,dialogue,Jill,Maybe you're mixing her up with another Cat Boomer?
159,undefined,undefined,dialogue,Virgilio,"No, that's not it..."
160,undefined,undefined,dialogue,Virgilio,It's like the bandaged girl last time.
161,undefined,undefined,dialogue,Virgilio,"Even with the bandages, there's just something really familiar about her."
162,undefined,undefined,dialogue,Jill,Maybe you need to stop thinking about it.
163,undefined,undefined,dialogue,Jill,Answers usually come to you when you stop stressing out.
164,undefined,undefined,dialogue,Virgilio,You might be right.
165,undefined,undefined,dialogue,Virgilio,That bandaged girl that came here last time...
166,undefined,undefined,dialogue,Jill,What about her?
167,undefined,undefined,dialogue,Virgilio,"I feel like I've met her before. I've been thinking a lot, but can't put my finger on it."
168,undefined,undefined,dialogue,Jill,Maybe you need to stop thinking about it.
169,undefined,undefined,dialogue,Jill,Answers usually come to you when you stop stressing out.
170,undefined,undefined,dialogue,Virgilio,You might be right.
171,undefined,undefined,dialogue,Virgilio,"Well, I leave you for now, bartender. Thanks for everything."
172,undefined,undefined,dialogue,Jill,Please come again.
173,undefined,undefined,dialogue,Jill,Welcome to Valhalla.
174,undefined,undefined,dialogue,Jill,"Oh, hello, Mister Detective."
175,undefined,undefined,dialogue,Art,...
176,undefined,undefined,dialogue,Jill,"(And here we are, another mute person wandering into the bar.)"
177,undefined,undefined,dialogue,Jill,Anything I can get you?
178,undefined,undefined,dialogue,Art,Gut Punch.
179,undefined,undefined,dialogue,Jill,Okay.
180,undefined,undefined,dialogue,Jill,Here.
181,undefined,undefined,dialogue,Art,"Oh, you got it right."
182,undefined,undefined,dialogue,Jill,Here.
183,undefined,undefined,dialogue,Art,Alright! Free drink!
184,undefined,undefined,dialogue,Jill,"So, what's up now?"
185,undefined,undefined,dialogue,Art,"A bit of holiday blues, you could say."
186,undefined,undefined,dialogue,Jill,So you celebrate Mega Christmas?
187,undefined,undefined,dialogue,Art,Why wouldn't I?
188,undefined,undefined,dialogue,Jill,You looked more like a Festivus kind of guy.
189,undefined,undefined,dialogue,Art,Why does everyone keep saying that?!
190,undefined,undefined,dialogue,Jill,"Well, Festivus IS a celebration going against the capitalist madness that is Mega Christmas."
191,undefined,undefined,dialogue,Jill,(And you know... cheapskate.)
192,undefined,undefined,dialogue,Art,"If you have something to say, say it."
193,undefined,undefined,dialogue,Jill,I'll refrain.
194,undefined,undefined,dialogue,Jill,"Although now that I think about it, ""holiday blues"" is not really tied to a specific celebration."
195,undefined,undefined,dialogue,Jill,Just the season.
196,undefined,undefined,dialogue,Art,A season of consumerist craze.
197,undefined,undefined,dialogue,Art,Mega Christmas is just a mockery of what the real Christmas once was.
198,undefined,undefined,dialogue,Art,"I mean, the season has slowly become enslaved to the corporations over time."
199,undefined,undefined,dialogue,Art,"""Holiday spirit"" can only be manipulated so much."
200,undefined,undefined,dialogue,Art,But then came that Turbo Male guy. He started a yearly tradition of dressing up like Santa in the ring.
201,undefined,undefined,dialogue,Jill,Turbo Male? That can't be his ring name.
202,undefined,undefined,dialogue,Art,It is.
203,undefined,undefined,dialogue,Jill,Really? Such a tacky name was accepted?
204,undefined,undefined,dialogue,Art,His partner was Buster Master and his rival was Dr. Chris Max. Tacky names were not a problem.
205,undefined,undefined,dialogue,Jill,"I mean, I knew there was a wrestler that dressed as Santa every year."
206,undefined,undefined,dialogue,Jill,I also knew that the guy became insanely popular and the stunt got out of control.
207,undefined,undefined,dialogue,Jill,"And, of course, that's the part everyone sings about."
208,undefined,undefined,dialogue,Jill,Santa became Nega Santa thanks to the Redmond Family.
209,undefined,undefined,dialogue,Jill,"Nega Santa sees the error of his ways and becomes the mighty Mega Santa, renaming the holiday Mega Christmas."
210,undefined,undefined,dialogue,Art,And then every company jumped on the bandwagon and Christmas was Mega Christmas before anyone noticed.
211,undefined,undefined,dialogue,Jill,So you're telling me that the guy who somehow managed to rename the holiday...
212,undefined,undefined,dialogue,Jill,"Went by the ring name ""Turbo Male""?"
213,undefined,undefined,dialogue,Art,Yup.
214,undefined,undefined,dialogue,Jill,...
215,undefined,undefined,dialogue,Jill,That makes the whole holiday sound like a joke.
216,undefined,undefined,dialogue,Art,The holiday IS a joke.
217,undefined,undefined,dialogue,Jill,And you're telling me you don't celebrate Festivus?
218,undefined,undefined,dialogue,Art,"*sigh* No, I don't."
219,undefined,undefined,dialogue,Art,Do you know what kind of people celebrate Festivus?
220,undefined,undefined,dialogue,Art,The kind that's so lame and bland that they can only talk about how they're better because they celebrate Festivus.
221,undefined,undefined,dialogue,Art,Like those jerks who only eat Nuke and think they're better than everyone else.
222,undefined,undefined,dialogue,Jill,I see...
223,undefined,undefined,dialogue,Jill,Anything else I can get you?
224,undefined,undefined,dialogue,Art,"Get me a Fringe Weaver, will you?"
225,undefined,undefined,dialogue,Jill,Sure.
226,undefined,undefined,dialogue,Jill,Here.
227,undefined,undefined,dialogue,Art,"Right, thanks."
228,undefined,undefined,dialogue,Jill,Here you are.
229,undefined,undefined,dialogue,Art,Hah! Thanks a lot.
230,undefined,undefined,dialogue,Jill,(I wonder if he'd be happy if I gave him thinner just because it's wrong and thus free?)
231,undefined,undefined,dialogue,Jill,"Okay, we both know it's not holiday blues. Why are you so down?"
232,undefined,undefined,dialogue,Art,Why so interested? Are you hitting on me?
233,undefined,undefined,dialogue,Jill,"Nah, just bored."
234,undefined,undefined,dialogue,Jill,"Besides, you could be my dad. I'd never hit on you."
235,undefined,undefined,dialogue,Art,You'd be surprised by the amount of girls that are into older men.
236,undefined,undefined,dialogue,Jill,Let me rephrase it: I'd never hit on you. Period.
237,undefined,undefined,dialogue,Art,"Whatever, I'm married, anyway."
238,undefined,undefined,dialogue,Art,So you wanna know why I'm feeling down?
239,undefined,undefined,dialogue,Jill,"If you don't want to tell me, it's okay."
240,undefined,undefined,dialogue,Art,"Nah, there's no problem."
241,undefined,undefined,dialogue,Art,"Well, you see. I found the girl I was looking for..."
242,undefined,undefined,dialogue,Art,...in her last moments.
243,undefined,undefined,dialogue,Jill,Huh... really?
244,undefined,undefined,dialogue,Art,"I followed her tracks and finally found her. Although to be fair, it's more like she stopped trying to cover them."
245,undefined,undefined,dialogue,Art,"She was just sitting in a room near some more corpses. From what I gathered later, seems it was some drug lab."
246,undefined,undefined,dialogue,Art,"She passed herself off as a prostitute, and then proceeded to kill everyone inside."
247,undefined,undefined,dialogue,Art,"When I found her, she was drugged to hell and back."
248,undefined,undefined,dialogue,Art,"According to what little I could get out of her, she was dying."
249,undefined,undefined,dialogue,Art,Seems the same rejection she used to kill her targets was also killing her too.
250,undefined,undefined,dialogue,Jill,"You mentioned she caused a Nanomachine Rejection of sorts, right?"
251,undefined,undefined,dialogue,Jill,"So I'm guessing the city's nanomachines seeped into her body, causing a reaction."
252,undefined,undefined,dialogue,Art,"As a psycho-for-hire, you'd think she'd have had the foresight to think about that before coming into the city."
253,undefined,undefined,dialogue,Art,"But anyway, I had a job to do, so I delivered her letter."
254,undefined,undefined,dialogue,Art,...only for her to tear it apart without reading it.
255,undefined,undefined,dialogue,Jill,"Must've been frustrating, huh?"
256,undefined,undefined,dialogue,Jill,"I mean, all that work for her to rip it to pieces."
257,undefined,undefined,dialogue,Art,I thought something like that might happen.
258,undefined,undefined,dialogue,Art,"To be honest, at that point, I was really just doing it for my own sense of peace."
259,undefined,undefined,dialogue,Jill,"Why tear the letter, though?"
260,undefined,undefined,dialogue,Art,"Apparently, the guy wasn't exactly the best father out there."
261,undefined,undefined,dialogue,Art,She was born for experimental purposes. A living guinea pig for her father's condition.
262,undefined,undefined,dialogue,Art,"He was literally going to use her to test any treatment, no matter how unorthodox."
263,undefined,undefined,dialogue,Art,"She was experimented upon from an early age. And when she found out what her blood was capable of, she just... snapped."
264,undefined,undefined,dialogue,Art,"In her own words, ""I didn't have to take shit from anyone anymore, not even my 'father'""."
265,undefined,undefined,dialogue,Art,"So she ran away, came to the city. Became a gun for hire..."
266,undefined,undefined,dialogue,Art,"Got trapped in that bank. Then, the rejection started to kick in..."
267,undefined,undefined,dialogue,Jill,Tough stuff.
268,undefined,undefined,dialogue,Art,"It hit me hard, you know? I kinda saw my own daughter in her at that moment."
269,undefined,undefined,dialogue,Art,The anger she bore against this old man...
270,undefined,undefined,dialogue,Art,I've seen it before. Many times while my daughter was a teen.
271,undefined,undefined,dialogue,Jill,Really?
272,undefined,undefined,dialogue,Art,"She... my daughter was born as a boy. And back then, spent all her time angry."
273,undefined,undefined,dialogue,Art,"I had a short fuse, so I lost control with her more often than not."
274,undefined,undefined,dialogue,Art,"I yelled at her, she yelled at me..."
275,undefined,undefined,dialogue,Jill,...
276,undefined,undefined,dialogue,Art,"When she turned 11, she started her transition process. Her behaviour changed a lot."
277,undefined,undefined,dialogue,Art,"She was calmer, friendlier... but my relationship with her was already fractured."
278,undefined,undefined,dialogue,Art,It wasn't until a couple of years ago that she decided to give me a second chance.
279,undefined,undefined,dialogue,Art,"I've been doing my best to make amends, but I still remember the anger on her face."
280,undefined,undefined,dialogue,Art,"And to see that girl, in her death throes, with that same look..."
281,undefined,undefined,dialogue,Art,...
282,undefined,undefined,dialogue,Jill,Maybe you shouldn't be here then.
283,undefined,undefined,dialogue,Art,Huh?
284,undefined,undefined,dialogue,Jill,"Maybe you should be with your daughter, preventing that stuff from ever happening again."
285,undefined,undefined,dialogue,Jill,You finished your job. Take your lesson to heart and go spend time with her.
286,undefined,undefined,dialogue,Jill,"Not everyone gets second chances, so don't waste it."
287,undefined,undefined,dialogue,Art,"Yeah, I'll do that. Thanks for everything, bartender."
288,undefined,undefined,dialogue,Jill,(Does that count as scaring a client off? Eh...)
289,undefined,undefined,dialogue,Jill,"So, any issues with the city lately? What's the word on the street?"
290,undefined,undefined,dialogue,Art,Shouldn't I be asking that?
291,undefined,undefined,dialogue,Art,"There's nothing new, really."
292,undefined,undefined,dialogue,Art,"The lynchings of White Knights stopped, so there's that."
293,undefined,undefined,dialogue,Jill,Really?
294,undefined,undefined,dialogue,Art,Something about the armor. I haven't gotten much on that one yet.
295,undefined,undefined,dialogue,Art,"All in all, the madness following the attack on the bank seems to have settled down a bit."
296,undefined,undefined,dialogue,Jill,That's good to hear.
297,undefined,undefined,dialogue,Jill,Have any other details about the attack emerged yet?
298,undefined,undefined,dialogue,Art,All records of whatever happened there have been long deleted.
299,undefined,undefined,dialogue,Art,"Security cams, system logs... everything was wiped."
300,undefined,undefined,dialogue,Art,"Whatever happened there, it's become even more of a mystery now."
301,undefined,undefined,dialogue,Jill,(I wonder if Sei plans on testifying.)
302,undefined,undefined,dialogue,Jill,(...does anyone know if Sei went there in the first place?)
303,undefined,undefined,dialogue,Jill,(Maybe the wiping of everything actually protects her somehow.)
304,undefined,undefined,dialogue,Art,"Hey, bartender. You okay?"
305,undefined,undefined,dialogue,Jill,"Sorry, got distracted."
306,undefined,undefined,dialogue,Art,"There's not much to say, really."
307,undefined,undefined,dialogue,Art,There's the odd silly rumor here and there.
308,undefined,undefined,dialogue,Art,Like the vending machines' tasers malfunctioning and applying more strength.
309,undefined,undefined,dialogue,Art,Or that the writer of The Last Rain In The World is actually living here as a brain in a jar.
310,undefined,undefined,dialogue,Art,But those are the kind of rumors you hear from crackheads.
311,undefined,undefined,dialogue,Art,"Crackheads might hold that one last piece of info you need, but you also hear crap like that."
312,undefined,undefined,dialogue,Jill,I see.
313,undefined,undefined,dialogue,Art,"Anyway, I'm leaving. Happy New Year, bartender."
314,undefined,undefined,dialogue,Jill,Please come again.
315,undefined,undefined,dialogue,Jill,Okay then... um...
316,undefined,undefined,dialogue,Jill,"Bo-... no, wait. She's out."
