line,filename,lines,type,character,text
283,undefined,undefined,dialogue,Dana,I know someone that might help me. I'll give her a call.
284,undefined,undefined,dialogue,Dana,Let's see... where was her number... oh! Here it is.
285,undefined,undefined,dialogue,Dana,"Hey, Iris! I need some unclogging advice."
286,undefined,undefined,dialogue,Jill,Iris?
287,undefined,undefined,dialogue,Gillian,I've heard Chief call her a couple of times. Maybe she's a friend?
288,undefined,undefined,dialogue,Gillian,"More importantly, will Chief be fine?"
289,undefined,undefined,dialogue,Jill,"She will. Even if there's no God or Buddha, you can always trust Boss."
290,undefined,undefined,dialogue,Gillian,Yeah... let's hope you're right.
291,undefined,undefined,dialogue,Dorothy,"Hey, honey! Can you see me?"
292,undefined,undefined,dialogue,Jill,"Ah, Dorothy."
293,undefined,undefined,dialogue,Jill,"Yeah, I can see you. Why?"
294,undefined,undefined,dialogue,Dorothy,Really? Man! Did they sell me the wrong stuff?
295,undefined,undefined,dialogue,Jill,Who sold you what?
296,undefined,undefined,dialogue,Dana,"Jill, I'm going out for a bit to buy a screwdriver and bacon and..."
297,undefined,undefined,dialogue,Dana,...are you talking to yourself again?
298,undefined,undefined,dialogue,Jill,"No, I'm not."
299,undefined,undefined,dialogue,Dorothy,Hello!
300,undefined,undefined,dialogue,Dana,"Oh, hello Dorothy... wherever you are."
301,undefined,undefined,dialogue,Dana,I'll be back in a bit then.
302,undefined,undefined,dialogue,Jill,She didn't see you?
303,undefined,undefined,dialogue,Dorothy,Oh! I get it now.
304,undefined,undefined,dialogue,Dorothy,They sold me a VIC Jammer. Not an optic camouflage system.
305,undefined,undefined,dialogue,Jill,Um... care to explain?
306,undefined,undefined,dialogue,Dorothy,Have you seen those pics or videos of someone stripping or undressing?
307,undefined,undefined,dialogue,Dorothy,But I mean the ones where the clothes are the only thing you see and the other person is invisible.
308,undefined,undefined,dialogue,Jill,...come again?
309,undefined,undefined,dialogue,Dorothy,There's people out there with a fetish for invisible people.
310,undefined,undefined,dialogue,Dorothy,Where you can only see a few articles of clothes floating about.
311,undefined,undefined,dialogue,Dorothy,"I was trying to find something that would let me cater to that fetish, but my contact misunderstood my request."
312,undefined,undefined,dialogue,Dorothy,I asked him to bring me something that'd make me invisible. And he did.
313,undefined,undefined,dialogue,Dorothy,But I'm only invisible to cameras.
314,undefined,undefined,dialogue,Jill,...
315,undefined,undefined,dialogue,Jill,"Even then, wouldn't your clothes be invisible too with such a jammer or something?"
316,undefined,undefined,dialogue,Dorothy,Hm... you have a point.
317,undefined,undefined,dialogue,Dorothy,Oh well. I'll work something out. Maybe I'll get a Nanocamo module.
318,undefined,undefined,dialogue,Jill,Nanocamo?
319,undefined,undefined,dialogue,Dorothy,Haven't you heard of Nanocamo?
320,undefined,undefined,dialogue,Dorothy,They're a military technology company that recently branched to civilian appliances.
321,undefined,undefined,dialogue,Dorothy,They use nanotechnology to make fabric or other materials take any color or texture you want.
322,undefined,undefined,dialogue,Dorothy,"You can order a module from them and change the colors of clothes, walls or tables with it!"
323,undefined,undefined,dialogue,Jill,Hm... sounds interesting. Maybe I'll look it up.
324,undefined,undefined,dialogue,Jill,What does that have to do with what you want though?
325,undefined,undefined,dialogue,Dorothy,"If I remember correctly, they have a module that makes things almost invisible to the human eye."
326,undefined,undefined,dialogue,Dorothy,It was quite pricey last I checked though.
327,undefined,undefined,dialogue,Jill,"""Almost""? ""To the human eye""?"
328,undefined,undefined,dialogue,Dorothy,"Well, it's not perfect, if you move you'd be an eerie, surroundings-colored blob."
329,undefined,undefined,dialogue,Dorothy,"And we Lilim see things differently, so it's ineffective against us."
330,undefined,undefined,dialogue,Dorothy,"Still, it might be what I need..."
331,undefined,undefined,dialogue,Dorothy,"Now, what was that about talking to yourself ""again""?"
332,undefined,undefined,dialogue,Jill,...
333,undefined,undefined,dialogue,Jill,Nothing important.
334,undefined,undefined,dialogue,Jill,What are you having?
335,undefined,undefined,dialogue,Dorothy,"I'm in a good mood, so give me a Piano Woman."
336,undefined,undefined,dialogue,Jill,Sure.
337,undefined,undefined,dialogue,Jill,One Piano Woman.
338,undefined,undefined,dialogue,Dorothy,"Thanks! I love these ones, you know?"
339,undefined,undefined,dialogue,Dorothy,I keep them for special occasions - whenever I'm feeling good or when I need to get out of a slump.
340,undefined,undefined,dialogue,Jill,And today?
341,undefined,undefined,dialogue,Dorothy,Today I feel good.
342,undefined,undefined,dialogue,Jill,That's nice.
343,undefined,undefined,dialogue,Jill,Here.
344,undefined,undefined,dialogue,Dorothy,Hm...
345,undefined,undefined,dialogue,Dorothy,"As much as I enjoy the company of men, this isn't my kind of drink."
346,undefined,undefined,dialogue,Dorothy,I don't like drinks that aren't sweet.
347,undefined,undefined,dialogue,Dorothy,I deal with enough bitterness at work.
348,undefined,undefined,dialogue,Jill,I'll keep it in mind.
349,undefined,undefined,dialogue,Jill,"(What does she mean by bitter-... wait, no. Don't wanna know.)"
350,undefined,undefined,dialogue,Jill,Here...
351,undefined,undefined,dialogue,Dorothy,Hm...
352,undefined,undefined,dialogue,Jill,...?
353,undefined,undefined,dialogue,Dorothy,Hmhmhm...
354,undefined,undefined,dialogue,Dorothy,"Wrong drink, but I can't say no to one of these. Lucky you."
355,undefined,undefined,dialogue,Jill,...
356,undefined,undefined,dialogue,Jill,Here.
357,undefined,undefined,dialogue,Dorothy,Buzz! Wrong!
358,undefined,undefined,dialogue,Dorothy,Don't worry. I still love you.
359,undefined,undefined,dialogue,Jill,That's... nice to know.
360,undefined,undefined,dialogue,Dorothy,"Okay, then. How's this for a bonus payment?"
361,undefined,undefined,dialogue,Jill,Oh... the ticket from Friday.
362,undefined,undefined,dialogue,Jill,(Can't believe I still remember that.)
363,undefined,undefined,dialogue,Dorothy,That guy was so nice in giving it to me.
364,undefined,undefined,dialogue,Dorothy,...too bad it was filled to the brim with dogs. I would've enjoyed the drink here otherwise.
365,undefined,undefined,dialogue,Jill,(I don't think this ticket should be valid...)
366,undefined,undefined,dialogue,Jill,"(...but then again, they were improvised, so there isn't really a contract involved or anything.)"
367,undefined,undefined,dialogue,Dorothy,You know...
368,undefined,undefined,dialogue,Jill,Hm?
369,undefined,undefined,dialogue,Dorothy,"If you're lonely enough to start talking to yourself, we could hit an arrangement."
370,undefined,undefined,dialogue,Dorothy,Keep me fed and I'll keep you company.
371,undefined,undefined,dialogue,Dorothy,"You'll still need to pay if you want to get naughty, though."
372,undefined,undefined,dialogue,Jill,I think I'll pass. I already have a cat that does all that.
373,undefined,undefined,dialogue,Dorothy,Do you pay him to-...
374,undefined,undefined,dialogue,Jill,Finish that sentence and I'll make sure you truly become invisible.
375,undefined,undefined,dialogue,Dorothy,"Fiiiiiiiiiiiiiiiine. Consider this a standing offer, though."
376,undefined,undefined,dialogue,Dorothy,Oh! Hey John!
377,undefined,undefined,dialogue,Gillian,"Ah, Dorothy."
378,undefined,undefined,dialogue,Dorothy,Didn't see you here last Friday.
379,undefined,undefined,dialogue,Gillian,I was... dealing with some stuff over the weekend.
380,undefined,undefined,dialogue,Jill,AND Monday.
381,undefined,undefined,dialogue,Gillian,"Yeah, yeah..."
382,undefined,undefined,dialogue,Dorothy,Was it a girl?
383,undefined,undefined,dialogue,Gillian,I wish...
384,undefined,undefined,dialogue,Dorothy,What did you do? What did you do?
385,undefined,undefined,dialogue,Gillian,I'd rather not talk about it.
386,undefined,undefined,dialogue,Dorothy,"Hey honey, what did he do?"
387,undefined,undefined,dialogue,Jill,Gil's been a complete mystery for as long as I've known him.
388,undefined,undefined,dialogue,Jill,His past is like a nebulous mass that tries to bite him every once in a while.
389,undefined,undefined,dialogue,Dorothy,Nebulous?
390,undefined,undefined,dialogue,Jill,You hear so much random stuff it's hard to make connections about what happened when.
391,undefined,undefined,dialogue,Jill,"And, you know, people lie."
392,undefined,undefined,dialogue,Dorothy,Does your boss know about it?
393,undefined,undefined,dialogue,Jill,"She said ""I'm not one to judge"". Seems like she knows what the hell's going on."
394,undefined,undefined,dialogue,Jill,But I think I'm better off not knowing. It's not really that necessary and it's a pain to think about.
395,undefined,undefined,dialogue,Gillian,"I'm... right here, you know?"
396,undefined,undefined,dialogue,Jill,Did I tell any lies?
397,undefined,undefined,dialogue,Gillian,"No, but..."
398,undefined,undefined,dialogue,Gillian,...nevermind.
399,undefined,undefined,dialogue,Dorothy,Oh yeah. About your boss. Why was she wearing a helmet?
400,undefined,undefined,dialogue,Jill,"She found it. She put it on. Now, she's stuck."
401,undefined,undefined,dialogue,Dorothy,"Oh. Yeah, randomly putting on stuff you find is problematic."
402,undefined,undefined,dialogue,Jill,No shit.
403,undefined,undefined,dialogue,Dorothy,"I mean, there's this girl that wanted to see if she could use a glass bottle as a-..."
404,undefined,undefined,dialogue,Jill,"*ahem* A bit early for those stories, don't you think?"
405,undefined,undefined,dialogue,Dorothy,Nope.
406,undefined,undefined,dialogue,Jill,"By the way, it's weird that I didn't see you yesterday."
407,undefined,undefined,dialogue,Dorothy,"I have a job too, you know?"
408,undefined,undefined,dialogue,Jill,"Yeah, but you usually come before you start."
409,undefined,undefined,dialogue,Dorothy,Aww... did you miss me that much?
410,undefined,undefined,dialogue,Dorothy,Yesterday was a bit different. I worked the entire day.
411,undefined,undefined,dialogue,Jill,I don't know if I should ask.
412,undefined,undefined,dialogue,Dorothy,"Oh, it was weird, but not... kinky weird?"
413,undefined,undefined,dialogue,Dorothy,The guy paid me to spend ALL DAY pretending to be his daughter.
414,undefined,undefined,dialogue,Jill,Really?
415,undefined,undefined,dialogue,Dorothy,"Yeah, I go to his house at 11 a.m, dress as requested and spend all day there."
416,undefined,undefined,dialogue,Dorothy,"Play some games, occasionally tell him I love him, go to bed when ordered, and leave."
417,undefined,undefined,dialogue,Dorothy,Nothing sexual. I used to expect him to push me against the ground and have his way with me.
418,undefined,undefined,dialogue,Dorothy,"But after three years, it's unlikely that'll happen."
419,undefined,undefined,dialogue,Jill,Three years?
420,undefined,undefined,dialogue,Dorothy,Yeah. One day a year for three years now.
421,undefined,undefined,dialogue,Dorothy,"Oh, but last year he also wanted me to play the part on his daughter's birthday."
422,undefined,undefined,dialogue,Jill,Wait a second... does he have a daughter or not?
423,undefined,undefined,dialogue,Dorothy,Had. Seems she died four years ago.
424,undefined,undefined,dialogue,Jill,Oh...
425,undefined,undefined,dialogue,Dorothy,Yup. I seem to attract that kind of people for some reason.
426,undefined,undefined,dialogue,Jill,What kind of people?
427,undefined,undefined,dialogue,Dorothy,Nobody. I said nothing.
428,undefined,undefined,dialogue,Dorothy,"Gimme a Moonblast, would you?"
429,undefined,undefined,dialogue,Jill,Sure.
430,undefined,undefined,dialogue,Jill,Here.
431,undefined,undefined,dialogue,Dorothy,There's something interesting about this drink.
432,undefined,undefined,dialogue,Dorothy,"I don't actually like it, but I can't stop drinking them."
433,undefined,undefined,dialogue,Jill,It tastes like a bit of sugar drowned in pure alcohol. Small wonder you feel like that.
434,undefined,undefined,dialogue,Jill,Here.
435,undefined,undefined,dialogue,Dorothy,"Alright, I'll take your offer this time."
436,undefined,undefined,dialogue,Dorothy,I'll let you know I don't do this with everyone.
437,undefined,undefined,dialogue,Jill,Right...
438,undefined,undefined,dialogue,Jill,Here yo-...
439,undefined,undefined,dialogue,Dorothy,And you're WRONG.
440,undefined,undefined,dialogue,Dorothy,"If I remember correctly, you have a recipe book. Mind using it?"
441,undefined,undefined,dialogue,Jill,...
442,undefined,undefined,dialogue,Jill,"Hey, did you see something about a concert outside?"
443,undefined,undefined,dialogue,Dorothy,A concert?
444,undefined,undefined,dialogue,Dorothy,"Yeah. Now that you mention it, I remember seeing a line near the stadium a couple of blocks away."
445,undefined,undefined,dialogue,Dorothy,"They couldn't take their eyes off of me, so I took some photos with them."
446,undefined,undefined,dialogue,Jill,Oh.
447,undefined,undefined,dialogue,Dorothy,Why do you ask?
448,undefined,undefined,dialogue,Jill,Someone was here just a minute ago. Seems he was interviewing the star of the show.
449,undefined,undefined,dialogue,Dorothy,Really? What kind of person is this star?
450,undefined,undefined,dialogue,Jill,Some girl. He didn't tell me her name.
451,undefined,undefined,dialogue,Jill,Seems she's a King-Class CH1A.
452,undefined,undefined,dialogue,Dorothy,Oh...
453,undefined,undefined,dialogue,Jill,What's with that reaction?
454,undefined,undefined,dialogue,Dorothy,"Nothing, it's just that the CH1A is the model that comes after mine."
455,undefined,undefined,dialogue,Jill,Really?
456,undefined,undefined,dialogue,Dorothy,"Yeah, they think they're so important because they have more sensitivity points in their skins."
457,undefined,undefined,dialogue,Dorothy,And because their voice modulators are more advanced.
458,undefined,undefined,dialogue,Jill,They do?
459,undefined,undefined,dialogue,Dorothy,"...n-no, I'm just kinda jealous that they do."
460,undefined,undefined,dialogue,Dorothy,"I had to mod myself to have what they have from the get-go, you know?"
461,undefined,undefined,dialogue,Jill,"Wait, they don't make DFC-72s like you anymore?"
462,undefined,undefined,dialogue,Dorothy,"My line is quite alive and well, thank you very much."
463,undefined,undefined,dialogue,Dorothy,The difference with the CH1A is mostly that they sacrifice functionality for appearance.
464,undefined,undefined,dialogue,Dorothy,They don't have an expansion port in their heads and their senses and abilities are more akin to those of humans.
465,undefined,undefined,dialogue,Dorothy,"They're mostly for human stand-ins, while my line is slightly more work-oriented."
466,undefined,undefined,dialogue,Jill,"Huh, I see."
467,undefined,undefined,dialogue,Dorothy,"Oh yeah, I think I saw the concert poster outside the bar."
468,undefined,undefined,dialogue,Jill,Poster...?
469,undefined,undefined,dialogue,Dorothy,"You work here, you should know which one!"
470,undefined,undefined,dialogue,Jill,I... kinda forget things on that entryway from time to time. All because of Didi and Gogo.
471,undefined,undefined,dialogue,Dorothy,Who?
472,undefined,undefined,dialogue,Jill,The vending machines outside. They blabber so much I've learned to ignore anything on the door.
473,undefined,undefined,dialogue,Dorothy,Oh! And here I was wondering why their volumes were reduced so much.
474,undefined,undefined,dialogue,Jill,"They're interesting to talk with, they just talk... so... much."
475,undefined,undefined,dialogue,Jill,You can actually get physically sick from listening to them for too long.
476,undefined,undefined,dialogue,Jill,There's something I've been meaning to ask you...
477,undefined,undefined,dialogue,Dorothy,"Yes, I'm single and I don't mind that you're a girl."
478,undefined,undefined,dialogue,Jill,Do you actually mind what anyone is?
479,undefined,undefined,dialogue,Dorothy,Not at all.
480,undefined,undefined,dialogue,Jill,"Anyway, it's not about that..."
481,undefined,undefined,dialogue,Jill,Do all DFC-72s look like kids?
482,undefined,undefined,dialogue,Dorothy,Yes and no.
483,undefined,undefined,dialogue,Dorothy,"Out of factory, we look like kids because our development needs to be as close to human as possible."
484,undefined,undefined,dialogue,Jill,Then you look like babies outside the factory?
485,undefined,undefined,dialogue,Dorothy,"Nope, every fresh DFC-72 looks about 10 to 13. It makes it easier to upgrade later."
486,undefined,undefined,dialogue,Jill,Upgrade?
487,undefined,undefined,dialogue,Dorothy,"Once a DFC-72 passes three ""maturity tests"" it can opt for a factory upgrade."
488,undefined,undefined,dialogue,Dorothy,Said upgrade alters its body to something older.
489,undefined,undefined,dialogue,Dorothy,"Some go for it, some don't."
490,undefined,undefined,dialogue,Jill,Will you go through it?
491,undefined,undefined,dialogue,Dorothy,"I don't know. Right now, I'm a rarity."
492,undefined,undefined,dialogue,Dorothy,"You don't find many like me in my line of work, so I have an advantage."
493,undefined,undefined,dialogue,Dorothy,"And I really need that advantage, you know?"
494,undefined,undefined,dialogue,Jill,How so?
495,undefined,undefined,dialogue,Dorothy,"When people hire me, half the time it's not because I'm me."
496,undefined,undefined,dialogue,Dorothy,The amount of roleplaying I have to do on a normal night is ridiculous.
497,undefined,undefined,dialogue,Dorothy,"So, if I stop looking underaged, I'll lose my advantage over everyone else."
498,undefined,undefined,dialogue,Jill,I didn't think about it that way.
499,undefined,undefined,dialogue,Jill,(Should I think about it at all?)
500,undefined,undefined,dialogue,Dorothy,"I mean, maybe I'll go through with it if I ever decide to retire or something."
501,undefined,undefined,dialogue,Dorothy,But right now I'm just fine the way I am!
502,undefined,undefined,dialogue,Jill,I see.
503,undefined,undefined,dialogue,Jamie,Good evening Gil.
504,undefined,undefined,dialogue,Jill & Gillian,Welcome to...!
505,undefined,undefined,dialogue,Jill & Gillian,...
506,undefined,undefined,dialogue,Dorothy,Does that happen a lot?
507,undefined,undefined,dialogue,Jill,Not really.
508,undefined,undefined,dialogue,Gillian,It would happen less if Jill would just let people call her Jules.
509,undefined,undefined,dialogue,Jill,"Call me Jules and I'll make sure every time you sit, you'll hear the *cling* of your shaker."
510,undefined,undefined,dialogue,Gillian,"Fine, fine..."
511,undefined,undefined,dialogue,Gillian,"I'll be with you in a minute, Jamie. Just let me finish here."
512,undefined,undefined,dialogue,Jamie,"Sure, no hurry."
513,undefined,undefined,dialogue,Dorothy,Hello sailor.
514,undefined,undefined,dialogue,Jill,...
515,undefined,undefined,dialogue,Jamie,"Hello, young lady."
516,undefined,undefined,dialogue,Dorothy,"Just call me Dorothy. You're Jamie, right?"
517,undefined,undefined,dialogue,Jamie,"Nice to meet you, Dorothy."
518,undefined,undefined,dialogue,Dorothy,"Hey, hey! Let me buy you a drink!"
519,undefined,undefined,dialogue,Jamie,"Oh, I couldn't let you do that..."
520,undefined,undefined,dialogue,Dorothy,I insist! I got a hefty bonus the other day and today I'm in a good mood.
521,undefined,undefined,dialogue,Jamie,I suppose it'd be impolite of me to reject...
522,undefined,undefined,dialogue,Jamie,"Sure, I'll take your offer."
523,undefined,undefined,dialogue,Dorothy,"Yay! Honey, I'll have a big Sunshine Cloud."
524,undefined,undefined,dialogue,Jamie,I'll be fine with just a Gut Punch.
525,undefined,undefined,dialogue,Dorothy,Come on! Don't be stingy! Ask for something more expensive!
526,undefined,undefined,dialogue,Jamie,I'd rather not.
527,undefined,undefined,dialogue,Jill,"(Man, that girl puts me on edge with the way she addresses people.)"
528,undefined,undefined,dialogue,Jill,Okay then. Let me get your orders.
529,undefined,undefined,dialogue,Jill,Here and here.
530,undefined,undefined,dialogue,Dorothy,Thank you!
531,undefined,undefined,dialogue,Jamie,"All in order. Thank you, Dorothy."
532,undefined,undefined,dialogue,Dorothy,Don't mention it.
533,undefined,undefined,dialogue,Jamie,And thank you Jill.
534,undefined,undefined,dialogue,Jill,It's my job.
535,undefined,undefined,dialogue,Jill,Here.
536,undefined,undefined,dialogue,Dorothy,"Honey, you mixed these up. Even though they're technically right."
537,undefined,undefined,dialogue,Dorothy,"Oh well, I'll give you an A for effort."
538,undefined,undefined,dialogue,Jamie,"I feel bad about having the big drink. Do you want some, Dorothy?"
539,undefined,undefined,dialogue,Dorothy,Nononononononono. Keep it for yourself.
540,undefined,undefined,dialogue,Jill,Here you are.
541,undefined,undefined,dialogue,Dorothy,Yay! Now we've matching drinks!
542,undefined,undefined,dialogue,Jamie,"Seems so. Perhaps, it's nice to have a change."
543,undefined,undefined,dialogue,Jill,Here you go.
544,undefined,undefined,dialogue,Dorothy,"Honey, this is so not funny. I hate bitter drinks."
545,undefined,undefined,dialogue,Dorothy,"Here, Jamie. Take mine."
546,undefined,undefined,dialogue,Jamie,"You shouldn't be rude with your clients, Jill."
547,undefined,undefined,dialogue,Jill,Y-Yeah...
548,undefined,undefined,dialogue,Jill,Here you go.
549,undefined,undefined,dialogue,Dorothy,"Is this your ""I don't know what I'm doing so have this"" order?"
550,undefined,undefined,dialogue,Dorothy,I heard restaurants do that from time to time.
551,undefined,undefined,dialogue,Jamie,You don't seem too upset about it.
552,undefined,undefined,dialogue,Dorothy,Because I really like this one.
553,undefined,undefined,dialogue,Dorothy,Jamie... Jamie... Jamie...
554,undefined,undefined,dialogue,Jamie,Hm? You want to repeat that in front of a mirror?
555,undefined,undefined,dialogue,Dorothy,"No, that doesn't cut it."
556,undefined,undefined,dialogue,Dorothy,You don't have a Jamie face. You look more like an Adam or a Jack.
557,undefined,undefined,dialogue,Dorothy,Just like how Fuckboy over there looks like a John to me.
558,undefined,undefined,dialogue,Gillian,F-Fuckboy?
559,undefined,undefined,dialogue,Dorothy,You also remind me of this one client I had a couple of years ago.
560,undefined,undefined,dialogue,Dorothy,You have the same stern look to your face.
561,undefined,undefined,dialogue,Dorothy,The guy made me dress in a school uniform with a training bra and some bunny panties.
562,undefined,undefined,dialogue,Dorothy,"Then he asked me to stand near the bed and say ""What are we doing for homework today?"""
563,undefined,undefined,dialogue,Dorothy,He jumped on top of me before I could even finish.
564,undefined,undefined,dialogue,Dorothy,"Just... tore open the uniform's shirt, ripping the buttons in the process."
565,undefined,undefined,dialogue,Dorothy,He shredded the training bra with his TEETH. Even ripped the panties.
566,undefined,undefined,dialogue,Jamie,...
567,undefined,undefined,dialogue,Jill,...
568,undefined,undefined,dialogue,Dorothy,"I ended up lying on the bed with this 50-something fucking me like a rabbit, while shaking me like a ragdoll."
569,undefined,undefined,dialogue,Dorothy,"He started spouting nonsense, like he was trying to live all of his fantasies at the same time or something."
570,undefined,undefined,dialogue,Dorothy,He lasted a long while. I'll give him that. But I was a mess afterwards.
571,undefined,undefined,dialogue,Gillian,Wait! Don't leave! Just ignore her... stories... dammit!
572,undefined,undefined,dialogue,Dorothy,And what do I find out a couple days later?
573,undefined,undefined,dialogue,Dorothy,The poor bastard is a mid-school teacher!
574,undefined,undefined,dialogue,Dorothy,Who knows how much he was holding inside up to that moment!
575,undefined,undefined,dialogue,Dorothy,"Anyways, I'm late. Nice meeting you, Jamie. You reminded me of a damn nice dick."
576,undefined,undefined,dialogue,Dorothy,"Bye, honey!"
577,undefined,undefined,dialogue,Jamie,I... don't know how I should react.
578,undefined,undefined,dialogue,Jill,Ignore her? Take her comments in stride? Drink even more?
579,undefined,undefined,dialogue,Jill,"She's a nice girl once you get past her, um... pluckiness."
580,undefined,undefined,dialogue,Gillian,"Pluckiness, my ass! The client she scared off always leaves nice tips!"
581,undefined,undefined,dialogue,Jamie,"Hey Dorothy, may I ask you something... ah, private?"
582,undefined,undefined,dialogue,Dorothy,"If you need a price list, I have a convenient card with updated fees!"
583,undefined,undefined,dialogue,Dorothy,I can give you a discount if you pay for the room or invite me to dinner.
584,undefined,undefined,dialogue,Jamie,"No, thank you. It's not about that."
585,undefined,undefined,dialogue,Dorothy,Then go ahead! I don't think you can ask me something I've never been asked before.
586,undefined,undefined,dialogue,Jamie,Is it true that the DFC-72 line leaves tracking nanomachines in the other person after... well...
587,undefined,undefined,dialogue,Dorothy,After they violate every hole in your body regardless of its original purpose?
588,undefined,undefined,dialogue,Jamie,...*ahem* Yes.
589,undefined,undefined,dialogue,Dorothy,That's a semi-myth that nobody has tried to dispel.
590,undefined,undefined,dialogue,Dorothy,"It's true, but also not true at the same time."
591,undefined,undefined,dialogue,Jamie,Care to explain?
592,undefined,undefined,dialogue,Dorothy,"We do have tracking nanomachines, but they're released when the body enters alert mode."
